id,fr,pron,info,en,fr_sentence,en_sentence,level,category,difficulty
1274,guérir,geʁiʁ,"v. — je guéris, nous guérissons",to heal / to recover,"Une opération sur sa gorge lui a permis de guérir de la pneumonie, mais elle l'a laissé sans voix.","An operation on his throat helped him recover from the pneumonia, but it left him without his voice.",A2,Verbs,2.0
1275,apparaître,apaʁɛtʁ,"v. — j'apparais, apparaissons",to appear,"Il y a des gens dans le monde si affamés que Dieu ne peut pas leur apparaître, sauf sous forme de pain.","There are people in the world so hungry, that God cannot appear to them except in the form of bread.",A2,Verbs,2.0
1276,arrivée,aʁive,n.m./f.,arrival,Tu es arrivée au moment où je sortais.,You arrived at the moment I left.,A2,General,2.0
1277,fan,fan,n.m./f.,fan,Tim est un énorme fan de comédie satirique.,Tim is a huge fan of satirical comedy.,A2,Sport,2.0
1278,malheureusement,maløʁøzəmɑ̃,adv.,unfortunately,Malheureusement il a refusé de venir.,Unfortunately he refused to come.,A2,General,2.0
1279,déclarer,deklaʁe,"v. — je déclare, déclarons",to declare,Avez-vous quelque chose à déclarer ?,Do you have anything to declare?,A2,Verbs,2.0
1280,couler,kule,"v. — je coule, coulons",to sink,C'est bien parfois de se la couler douce.,It's okay to take it easy sometimes.,A2,Verbs,2.0
1281,vitesse,vitɛs,n.f.,speed,Nous pouvons voyager dans le temps. Et nous le faisons à la vitesse incroyable d’une seconde par seconde.,We can travel through time. And we do at the remarkable rate of one second per second.,A2,General,2.0
1282,os,ɔs,n.m.,bone,Le chien ronge un os dans le jardin.,The dog is gnawing a bone in the garden.,A2,Body & Health,2.0
1283,indiquer,ɛ̃dike,"v. — j'indique, indiquons",to connote,Il fut assez aimable de nous indiquer le bureau de poste.,He was kind enough to show me the post office.,A2,Verbs,2.0
1284,coffre,kɔfʁ,n.m./f.,"chest, box",Je dépose l'argent dans un coffre.,I put money in a safe.,A2,Home,2.0
1286,gêner,ʒene,"v. — je gêne, gênons","to hinder, hamper, bother","Malgré l'écriteau « Défense de fumer », l'homme qui dirigeait le bateau fumait tout le temps sans se gêner.","Despite ""No Smoking"" signs, the boat operator was brazenly smoking all the time.",A2,Verbs,2.0
1287,génie,ʒeni,n.m.,genius,Vous avez le génie de la musique.,You have a genius for music.,A2,General,2.0
1288,bloquer,bloke,"v. — je bloque, bloquons",to block,Il faut bloquer l'accès à cette rue.,The access to this road has to be blocked.,A2,Verbs,2.0
1289,amusant,amyzɑ̃,adj.,amusing / fun,Je savais qu'aujourd'hui serait amusant.,I knew that today would be fun.,A2,Adjectives,2.0
1290,infirmier,ɛ̃fiʁmje,n.m.,nurse,"Il n'est pas médecin, mais infirmier.","He's not a doctor, but a nurse.",A2,Body & Health,2.0
1291,autoriser,otoʁize,"v. — j'autorise, autorisons",to authorise,Je ne peux pas vous autoriser à entrer là.,I can't let you in there.,A2,Verbs,2.0
1292,flingue,flɛ̃g,n.m./f.,"shooter, pistol, gat",Tom a jeté son flingue dans la rivière.,Tom threw his gun into the river.,A2,General,2.0
1293,folie,foli,n.m./f.,"madness, folly, insanity",Qui vit sans la folie n'est pas aussi sage qu'il croit.,Who lives without folly is not so wise as he thinks.,A2,Emotions,2.0
1294,majesté,maʒɛste,n.m./f.,majesty,Comment Sa Majesté pourrait-elle se tromper..?,How could Her Majesty be wrong..?,A2,General,2.0
1295,également,egaləmɑ̃,adv.,equally,Tu dois également lire ce livre.,You must read this book also.,A2,General,2.0
1296,soigner,swaɲe,"v. — je soigne, nous soignons",to care for / to treat,"Si tu veux être élu, tu vas devoir soigner ton image.","If you want to get elected, you're going to have to improve your public image.",A2,Verbs,2.0
1297,parfaitement,paʁfɛtəmɑ̃,adv.,perfectly,Je comprends parfaitement votre position.,I understand your position perfectly.,A2,General,2.0
1298,pantalon,pɑ̃talɔ̃,n.m./f.,trousers,"Oh, mon pantalon blanc ! Il était neuf.","Oh, my white pants! And they were new.",A2,Shopping,2.0
1299,marre,maʁ,adv.,a sort of hoe,J'en ai marre de manger du fast-food.,I'm tired of eating fast food.,A2,General,2.0
1300,observer,opsɛʁve,"v. — j'observe, nous observons",to observe / to watch,Nous devons observer les règles.,We must observe the rules.,A2,Verbs,2.0
1301,là-haut,lao,adv.,up there,"Nous vîmes quelque chose bouger parmi les ombres juste là-haut, devant.",We saw something move in the shadows just up ahead.,A2,General,2.0
1302,mm,milimɛtʁ,n.m./f.,alternative form of MM.,Les enfants couraient nus sur la plage.,The children were running naked on the beach.,A2,General,2.0
1303,nu,ny,adj.,naked,MM. Dupont et Martin sont arrivés à la réunion.,Messrs. Dupont and Martin arrived at the meeting.,A2,Adjectives,2.0
1304,détective,detɛktiv,n.m./f.,detective,Un détective arriva sur la scène du crime.,A detective arrived upon the scene of the crime.,A2,General,2.0
1305,limite,limit,n.m./f.,limit,La mort n'est qu'un horizon ; et un horizon n'est rien si ce n'est la limite de notre vision.,"Death is only a horizon, and a horizon is nothing save the limit of our sight.",A2,General,2.0
1306,théorie,teoʁi,n.f.,theory,Je pense que j'ai une théorie à ce sujet.,I think I have a theory about that.,A2,Education,2.0
1307,émission,emisjɔ̃,n.m./f.,emission,Il y a une courte émission sur les actualités locales à la radio.,There is a short program of local news on the radio.,A2,Arts,2.0
1308,trésor,tʁezɔʁ,n.m.,treasure,Les pirates ont enfoui leur trésor sous terre.,The pirates buried their treasure in the ground.,A2,General,2.0
1309,piège,pjɛʒ,n.m./f.,"trap, snare, booby trap",Ce vieil homme a libéré le renardeau du piège.,The old man freed the little fox from the trap.,A2,General,2.0
1310,propriétaire,pʁopʁijetɛʁ,n.m./f.,owner,Le propriétaire lui a demandé de partir car il n'avait pas payé son loyer.,The landlord told him to leave because he hadn't paid his rent.,A2,General,2.0
1311,collègue,kolɛg,n.m./f.,colleague,M. Brun est jaloux du succès de son collègue.,Mr Brown is jealous of his colleague's success.,A2,Work,2.0
1312,arracher,aʁaʃe,"v. — j'arrache, arrachons","to uproot, pull up, tear out","Faire parler la timide Kyoko à une fête, c'est comme lui arracher les dents.",Getting shy Kyoko to talk at a party is like pulling teeth.,A2,Verbs,2.0
1313,fabriquer,fabʁike,"v. — je fabrique, fabriquons",to make,Cela fut-il difficile à fabriquer ?,Was it difficult to make?,A2,Verbs,2.0
1314,criminel,kʁiminɛl,n.m./f.,criminal,Le criminel a été condamné à dix ans de prison.,The criminal was sentenced to ten years in prison.,A2,People,2.0
1315,donnée,done,n.m./f.,feminine singular of donné,L'information que tu m'as donnée ne m'aide guère.,The information you gave me is of little use.,A2,Technology,2.0
1316,date,dat,n.f.,date,La vieille église sur la colline date du douzième siècle.,The old church on the hill dates back to the twelfth century.,A2,Time,2.0
1317,cinéma,sinema,n.m./f.,"cinema, filmmaking",Pourquoi est-ce que les gens vont au cinéma ?,Why do people go to the movies?,A2,Arts,2.0
1318,passage,pasaʒ,n.m./f.,the act of going through a place or event,Il y a un passage secret à gauche.,There's a secret path on the left.,A2,General,2.0
1319,in,in,adj.,in / trendy,Ce restaurant est très in en ce moment.,This restaurant is very trendy at the moment.,A2,Adjectives,2.0
1320,informer,ɛ̃fɔʁme,"v. — j'informe, nous informons",to inform,Tu devrais informer la police immédiatement.,You should notify the police at once.,A2,Verbs,2.0
1321,balancer,balɑ̃se,"v. — je balance, balançons",to swing,Les hautes constructions peuvent balancer par temps venteux.,Tall buildings may sway in a strong wind.,A2,Verbs,2.0
1322,siècle,sjɛkl,n.m.,century,Qu'est-ce que cela signifie d'avoir un esprit éduqué au XXIe siècle ?,What does it mean to have an educated mind in the 21st century?,A2,Time,2.0
1323,marquer,maʁke,"v. — je marque, marquons","to mark, mark down",Il y a eu un défilé pour marquer l'occasion.,There was a parade to mark the occasion.,A2,Verbs,2.0
1324,profond,pʁofɔ̃,adj.,deep / profound,Les idées de Freud sur le comportement humain l'ont amené à être honoré en tant que profond penseur.,Freud's insights into human behavior led to him being honored as a profound thinker.,A2,Adjectives,2.0
1325,enfoiré,ɑ̃fwaʁe,n.m./f.,"dickhead, fuckhead, shithead","Quel enfoiré, il m'a volé mon téléphone !","What a bastard, he stole my phone!",A2,General,2.0
1326,étonner,etone,"v. — j'étonne, étonnons",to surprise,Ceci ne doit pas l’étonner.,This shouldn't surprise him.,A2,Verbs,2.0
1327,employé,ɑ̃plwaje,n.m./f.,employee,"S'il avait été honnête, je l'aurais employé.","If he had been honest, I would have employed him.",A2,Work,2.0
1328,préféré,pʁefeʁe,adj.,favourite,Quel est ton plat préféré dans ce restaurant ?,What is your favourite dish in this restaurant?,A2,Adjectives,2.0
1329,disputer,dispyte,"v. — je dispute, disputons",to dispute,Mes parents n'arrêtent pas de se disputer sur des choses stupides. C'est tellement énervant !,My parents keep arguing about stupid things. It's so annoying!,A2,Verbs,2.0
1330,succès,syksɛ,n.m.,success,Je suis certain de ton succès.,I'm certain of your success.,A2,General,2.0
1331,mode,mɔd,n.m./f.,"fashion, trend",Les robes longues sont restées à la mode.,Long dresses stayed in fashion.,A2,Shopping,2.0
1332,sorcier,sɔʁsje,n.m./f.,"sorcerer, magician, warlock",Le sorcier agita sa baguette magique et disparut dans le néant.,The wizard waved his magic wand and disappeared into thin air.,A2,People,2.0
1333,court,kuʁ,adj.,short,Elle a les cheveux courts et les yeux verts.,She has short hair and green eyes.,A2,Adjectives,2.0
1334,traitement,tʁɛtəmɑ̃,n.m.,treatment,Sais-tu utiliser un logiciel de traitement de texte ?,Do you know how to use a word processor?,A2,Body & Health,2.0
1335,appuyer,apɥije,"v. — j'appuie, appuyons","to press, push",Appuyer sur ce bouton pour démarrer la machine.,Press this button to start the machine.,A2,Verbs,2.0
1336,ranger,ʁɑ̃ʒe,"v. — je range, nous rangeons",to tidy / to put away,Devrais-je ranger mon sac dans le compartiment du haut ?,Should I put this bag in the overhead compartment?,A2,Verbs,2.0
1337,correspondre,koʁɛspɔ̃dʁ,"v. — je corresponds, correspondons",to correspond,Tes paroles doivent correspondre à tes actions.,Your words must correspond with your actions.,A2,Verbs,2.0
1338,examiner,ɛgzamine,"v. — j'examine, examinons",to examine,Vous devriez examiner les faits d'un point de vue médical.,You should investigate the fact from a medical viewpoint.,A2,Verbs,2.0
1339,assassiner,asasine,"v. — j'assassine, assassinons",to assassinate,Ils complotent pour assassiner le roi.,They are plotting to kill the king.,A2,Verbs,2.0
1340,côte,kot,n.f.,coast / coastline,La famille de Paul passe l'été sur la côte chaque année.,Paul's family spends the summer at the coast every year.,A2,Geography,2.0
1341,voter,vote,"v. — je vote, votons",to vote,"Quand ce fut le moment de voter, il s'abstint.","When it was time to vote, he abstained.",A2,Verbs,2.0
1342,au-dessus,odəsy,adv.,above,Votre dissertation anglaise est au-dessus de la moyenne.,Your English composition is above the average.,A2,General,2.0
1343,effort,efɔʁ,n.m.,effort,Rien n'est accompli sans effort.,Nothing is achieved without effort.,A2,General,2.0
1344,samedi,samədi,n.m.,Saturday,Je dois rendre le livre avant samedi.,I have to give back the book before Saturday.,A2,Time,2.0
1345,oeuvre,œvʁ,n.m./f.,nonstandard spelling of œuvre,Cette peinture est une grande oeuvre d'art.,This painting is a great work of art.,A2,General,2.0
1346,piéger,pjeʒe,"v. — je piège, piégeons",to trap,Je pense qu'il est cruel de piéger des animaux pour en faire des manteaux de fourrure.,I think it is cruel to trap animals for fur coats.,A2,Verbs,2.0
1347,gay,gɛ,adj.,gay,Mes parents renieraient mon frère s'ils venaient à découvrir qu'il était gay.,My parents would repudiate my brother if they ever found out he was gay.,A2,Adjectives,2.0
1348,directement,diʁɛktəmɑ̃,adv.,directly,Elle est retournée directement à son bureau à la fin de la réunion.,After the meeting she headed straight to her desk.,A2,General,2.0
1349,réunir,ʁeyniʁ,"v. — je réunis, nous réunissons",to reunite / to gather,On s'est fixé comme règle de se réunir régulièrement.,We make it a rule to get together at intervals.,A2,Verbs,2.0
1350,bête,bɛt,adj.,stupid / silly,Je suis trop bête... J'essaie de t'expliquer des choses que je ne comprends pas moi-même.,I'm so dumb... I'm trying to explain things to you that I don't understand myself.,A2,Adjectives,2.0
1351,américain,ameʁikɛ̃,n.m./f.,of or pertaining to America,Un Américain m'a demandé le chemin de la tour Eiffel.,An American asked me the way to the Eiffel Tower.,A2,General,2.0
1352,paquet,pakɛ,n.m./f.,packet,J'aimerais que vous me fassiez un paquet cadeau.,I'd like to have that gift wrapped.,A2,General,2.0
1353,miracle,miʁakl,n.m./f.,miracle,Ce n'est rien moins qu'un miracle.,It's nothing short of a miracle.,A2,General,2.0
1354,site,sit,n.m.,site / website,"D'abord, je vais faire un schéma de mon nouveau site internet.","First, I'm going to do an outline of my new website.",A2,Technology,2.0
1355,déménager,demenaʒe,"v. — je déménage, nous déménageons",to move house,"Si j'avais davantage d'argent, je pourrais déménager pour une maison plus grande.","If I had more money, I could move to a bigger house.",A2,Verbs,2.0
1356,bataille,bataj,n.m./f.,battle,Tu ne peux pas livrer une bonne bataille avec une attitude aussi défaitiste.,You can't fight a good fight with such a defeatist attitude.,A2,General,2.0
1357,mordre,mɔʁdʁ,"v. — je mords, mordons",to bite,Il vous fera mordre la poussière.,He will make you eat dirt.,A2,Verbs,2.0
1358,insister,ɛ̃siste,"v. — j'insiste, insistons","to insist, emphasize",Je veux insister sur ce point en particulier.,I want to emphasize this point in particular.,A2,Verbs,2.0
1359,fesse,fɛs,n.m./f.,buttock,Il s'est fait une injection dans la fesse.,He got an injection in the buttock.,A2,General,2.0
1360,révéler,ʁevele,"v. — je révèle, révélons","to reveal, to give away",Le journaliste a refusé de révéler ses sources.,The reporter refused to name his sources.,A2,Verbs,2.0
1361,hasard,azaʁ,n.m.,chance / coincidence,Est-ce que tu sais par hasard où j'ai mis mes clés ?,Any chance you know where I put my keys?,A2,General,2.0
1362,serrer,seʁe,"v. — je serre, serrons",to tighten,Les fans cherchaient à serrer la main de l'actrice.,The fans sought to shake the actress's hand.,A2,Verbs,2.0
1363,millier,milje,n.m./f.,thousand,Presque un millier de personnes ont pris part à la manifestation.,Nearly a thousand people participated in the demonstration.,A2,General,2.0
1364,bal,bal,n.m./f.,"dance party, ball",Ce fut une surprise de voir tous les étudiants se comporter avec convenance le soir du bal de fin d’année.,It was a surprise to see all the students behaving with decorum on prom night.,A2,General,2.0
1365,ombre,ɔ̃bʁ,n.f.,shadow / shade,Les événements à venir projettent leur ombre.,Coming events cast their shadows before.,A2,Nature,2.0
1366,soucier,susje,"v. — je soucie, soucions",to worry,Il est du genre à ne pas se soucier des détails.,He's the type who doesn't worry about details.,A2,Verbs,2.0
1367,dimanche,dimɑ̃ʃ,n.m.,Sunday,Je travaille même le dimanche.,I work even on Sunday.,A2,Time,2.0
1368,journaliste,ʒuʁnalist,n.m./f.,a journalist,Le journaliste critiqua le politicien.,The reporter criticized the politician.,A2,People,2.0
1370,fac,fak,n.m./f.,abbreviation of Forces armées canadiennes: CAF,Je travaille pour me payer mon inscription à la fac.,I am working to save for my college tuition.,A2,General,2.0
1371,effrayer,efʁɛje,"v. — j'effraye, effrayons","to frighten, to scare, to affray","Si je voulais vous effrayer, je vous aurais dit ce dont j'ai rêvé il y a quelques semaines.","If I wanted to scare you, I would have told you about what I dreamt about a few weeks ago.",A2,Verbs,2.0
1372,former,fɔʁme,"v. — je forme, formons",to form,"Lorsque le têtard croît, la queue disparaît et les pattes commencent à se former.","As a tadpole grows, the tail disappears and legs begin to form.",A2,Verbs,2.0
1373,poids,pwa,n.m.,weight,La glace va céder sous ton poids.,The ice will give under your weight.,A2,General,2.0
1374,louer,lwe,"v. — je loue, nous louons",to rent / to praise,"J'aimerais louer votre voiture la moins chère, pour une semaine.",I'd like to rent your most inexpensive car for a week.,A2,Verbs,2.0
1375,viande,vjɑ̃d,n.f.,meat,Sais-tu comment cuire de la viande ?,Do you know how to cook meat?,A1,Food & Drink,1.0
1376,crever,kʁəve,"v. — je crève, crevons","to pop, burst",Elle me laisserait crever la gueule ouverte.,She wouldn't even piss on me if I were on fire.,A2,Verbs,2.0
1377,chaise,ʃɛz,n.f.,chair,Tu peux t'asseoir sur la chaise.,You may sit down in the chair.,A1,Home,1.0
1378,menteur,mɑ̃tœʁ,n.m./f.,liar,Cela tend à prouver que vous êtes un menteur.,That just goes to prove that you are a liar.,A2,People,2.0
1379,tir,tiʁ,n.m./f.,"shot, shooting",Je n'ai jamais vu un tir pareil.,I've never seen a shot like that.,A2,General,2.0
1382,abattre,abatʁ,"v. — j'abats, abattons",to butcher,Nous devons travailler dur à abattre les barrières sociales.,We must work hard to break down social barriers.,A2,Verbs,2.0
1383,km,kilɔmɛtʁ,n.m.,kilometre,La ville est à cinquante km d'ici.,The town is fifty km from here.,A2,General,2.0
1384,échange,eʃɑ̃ʒ,n.m./f.,exchange,Une fille me donna une orange en échange d'un morceau de gâteau.,A girl gave me an orange in exchange for a piece of cake.,A2,General,2.0
1385,agréable,agʁeabl,adj.,pleasant / nice,"Aucun amour n'est mauvais, ni aucune prison agréable.",No love is foul nor prison fair.,A2,Adjectives,2.0
1386,joueur,ʒwœʁ,n.m.,player,Tom est un très bon joueur de tennis.,Tom is a very good tennis player.,A2,Sport,2.0
1387,militaire,militɛʁ,adj.,"military, militaristic",Une vie trop facile corrompit l'esprit militaire.,Easy living corrupted the warrior spirit.,A2,Adjectives,2.0
1388,saisir,seziʁ,"v. — je saisis, saisissons",to take hold of,"Tu aurais dû saisir la chance, alors.",You should have taken a chance then.,A2,Verbs,2.0
1389,emploi,ɑ̃plwa,n.m.,job / employment,Vous avez finalement réussi à trouver un emploi.,You finally succeeded in getting a job.,A2,Work,2.0
1390,effacer,efase,"v. — j'efface, nous effaçons",to erase,Il souhaite effacer de mauvais souvenirs.,He wishes to erase bad memories.,A2,Verbs,2.0
1391,éliminer,elimine,"v. — j'élimine, éliminons",to eliminate,Nous poursuivrons nos efforts pour éliminer la discrimination raciale.,We shall continue our efforts to eradicate racial discrimination.,A2,Verbs,2.0
1392,naissance,nɛsɑ̃s,n.f.,birth,La prolifération de l'utilisation d'Internet a donné naissance à une nouvelle génération de jeunes.,The proliferation of Internet usage has given birth to a new generation of young people.,A2,Family,2.0
1393,parti,paʁti,n.m.,party (political),À quel parti êtes-vous affilié ?,Which party do you belong to?,A2,General,2.0
1394,nouvel,nuvɛl,adj.,Form of nouveau,Il me faut un nouvel ordinateur.,I have to get a new computer.,A2,Adjectives,2.0
1395,vision,vizjɔ̃,n.m./f.,"vision, sight",La mort n'est qu'un horizon ; et un horizon n'est rien si ce n'est la limite de notre vision.,"Death is only a horizon, and a horizon is nothing save the limit of our sight.",A2,General,2.0
1396,piquer,pike,"v. — je pique, piquons",to prick,Un moustique vient de me piquer.,A mosquito just bit me.,A2,Verbs,2.0
1397,titre,titʁ,n.m.,title,Le gros titre attira mon attention ce matin.,The headline caught my eye this morning.,A2,General,2.0
1398,vente,vɑ̃t,n.f.,sale,J'ai fait acquisition de ce tableau lors d'une vente aux enchères.,I obtained the painting at an auction.,A2,Shopping,2.0
1399,rat,ʁa,n.m.,rat,Une chauve-souris est autant un oiseau qu'un rat peut l'être.,A bat is no more a bird than a rat is.,A2,Animals,2.0
1400,rencontre,ʁɑ̃kɔ̃tʁ,n.f.,meeting / encounter,La rencontre sportive s'est déroulée comme prévue.,The athletic meeting went on as scheduled.,A2,General,2.0
1401,sport,spɔʁ,n.m.,sport,Pratiquez-vous quelque sport ?,Do you play any sports?,A1,Sport,1.0
1402,mets,mɛ,n.m./f.,dish,Arrête ! Tu la mets mal à l'aise !,Stop it! You're making her feel uncomfortable!,A2,General,2.0
1403,douche,duʃ,n.m./f.,shower,Je prends habituellement ma douche le soir.,I usually take a shower in the evening.,A2,Home,2.0
1404,cri,kʁi,n.m./f.,cry,Le cri de l'enfant était effectivement strident.,The child's shout was indeed shrill.,A2,Body & Health,2.0
1405,participer,paʁtisipe,"v. — je participe, participons",to participate,Avez-vous prévu de participer à la réunion ?,Are you planning to take part in the meeting?,A2,Verbs,2.0
1406,volonté,volɔ̃te,n.f.,will,Un démocrate est un citoyen libre qui se plie à la volonté de la majorité.,A democrat is a free citizen who yields to the will of the majority.,A2,General,2.0
1407,chasse,ʃas,n.m./f.,"hunt, hunting",L'aigle ne chasse pas les mouches.,The eagle does not catch flies.,A2,General,2.0
1408,assassin,asasɛ̃,n.m./f.,an assassin or other murderer,Il ne vaut pas mieux qu'un assassin.,He is no better than a murderer.,A2,People,2.0
1409,promesse,pʁomɛs,n.m./f.,promise,Vous devez tenir votre promesse.,You must stick to your promise.,A2,General,2.0
1411,mine,min,n.m./f.,mine,Cette mine fermera ses portes le mois prochain.,This mine will close down next month.,A2,General,2.0
1412,station,stasjɔ̃,n.m./f.,station,Combien de temps cela prend-il pour arriver à la station ?,How long does it take to get to the station?,A2,General,2.0
1413,vampire,vɑ̃piʁ,n.m./f.,vampire,"Voudrais-tu être un vampire, si tu pouvais ?",Would you want to be a vampire if you could?,A2,General,2.0
1414,assurance,asyʁɑ̃s,n.m./f.,self-confidence,"En cas de retard de la cargaison, nous avons une assurance retard spéciale.","In case the shipment is delayed, we have special delay insurance.",A2,General,2.0
1415,cadavre,kadavʁ,n.m./f.,"corpse, cadaver",Un ours ne touchera pas un cadavre.,A bear will not touch a dead body.,A2,General,2.0
1416,tableau,tablo,n.m.,board / painting,Compare ta traduction avec celle du tableau.,Compare your translation with the one on the blackboard.,A2,Education,2.0
1417,retraite,ʁətʁɛt,n.m./f.,feminine singular of retrait,Il lui est difficile de vivre de sa maigre retraite.,It's hard for him to live on his small pension.,A2,Work,2.0
1419,pur,pyʁ,adj.,pure,L'éducation ne consiste pas seulement dans l'apprentissage pur et dur.,Education does not consist simply in learning a lot of facts.,A2,Adjectives,2.0
1420,décevoir,dɛsəvwaʁ,"v. — je déçois, décevons",to disappoint,Je suis désolé de décevoir tes plans.,I'm sorry to upset your plans.,A2,Verbs,2.0
1421,punir,pyniʁ,"v. — je punis, nous punissons",to punish,Nous pensions qu'il était injuste que vous dussiez le punir.,We thought it wrong that you should punish him.,A2,Verbs,2.0
1422,prisonnier,pʁizonje,n.m./f.,prisoner,Le roi ordonna que le prisonnier soit libéré.,The king ordered that the prisoner should be set free.,A2,People,2.0
1423,social,sosjal,adj.,"social, related to society, community",La compagnie a son siège social à Osaka.,The firm has its head office in Osaka.,A2,Adjectives,2.0
1424,siège,sjɛʒ,n.m./f.,"seat, chair",J'ai demandé un siège dans le compartiment fumeur.,I asked for a seat in the smoking section.,A2,General,2.0
1426,imbécile,ɛ̃besil,n.m./f.,"stupid, foolish, acting like an imbecile",Merci de m'avoir expliqué finalement pourquoi on me prend pour une imbécile.,Thanks for having explained to me at last why people take me for an idiot.,A2,People,2.0
1427,univers,ynivɛʁ,n.m./f.,universe,Y a-t-il d'autres univers en dehors du nôtre ?,Are there other universes outside our own?,A2,General,2.0
1428,franchement,fʁɑ̃ʃəmɑ̃,adv.,frankly,Dis-moi franchement ce que tu penses.,Tell me truly what you think.,A2,General,2.0
1429,naturel,natyʁɛl,adj.,natural,John a un penchant naturel pour le tennis.,John has a natural bent for tennis.,A2,Adjectives,2.0
1430,élève,elɛv,n.m./f.,pupil,Un enseignant ne devrait jamais se moquer d'un élève qui fait une faute.,A teacher should never make fun of a pupil who makes a mistake.,A2,Education,2.0
1431,fiancé,fjɑ̃se,n.m./f.,engaged,Bob est fiancé à Marie depuis plus d'un an.,Bob has been engaged to Mary for over a year.,A2,Family,2.0
1432,relever,ʁələve,"v. — je relève, relevons",to stand up,J'aime ajouter du basilic pour relever ma sauce spaghetti.,I like to add basil to season my spaghetti sauce.,A2,Verbs,2.0
1433,cigarette,sigaʁɛt,n.m./f.,cigarette,Vous avez fait un trou dans mon manteau avec votre cigarette.,You burnt a hole in my coat with your cigarette.,A2,General,2.0
1434,rattraper,ʁatʁape,"v. — je rattrape, rattrapons",to get back,Vous devez étudier dur pour rattraper votre classe.,You have to study hard to catch up with your class.,A2,Verbs,2.0
1435,complet,kɔ̃plɛ,adj.,"full, without room for more",Je vous ferai un nouveau complet.,I'll make you a new suit.,A2,Adjectives,2.0
1436,queue,kø,n.m./f.,tail,Un lapin a de longues oreilles et une petite queue.,A rabbit has long ears and a short tail.,A2,General,2.0
1437,ramasser,ʁamase,"v. — je ramasse, ramassons",to pick up,Je ne veux pas ramasser de la merde de chien.,I don't wanna clean up dog shit.,A2,Verbs,2.0
1438,salon,salɔ̃,n.m.,living room,Le salon jouxte la salle à manger.,The living room adjoins the dining room.,A2,Home,2.0
