id,fr,pron,info,en,fr_sentence,en_sentence,level,category,difficulty
3800,coiffure,kwafyʁ,n.f.,hairstyle / hairdressing,Je ne pouvais m'empêcher de rire de sa coiffure.,I couldn't help laughing at his haircut.,B2,General,3.5
3801,fermier,fɛʁmje,n.m.,farmer,Le fermier a surpris le garçon en train de voler les pommes dans son verger.,The farmer caught the boy stealing the apples in his orchard.,B2,Work,3.5
3802,gène,ʒɛn,n.m.,gene,L'ADN est un composé chimique complexe qui constitue un gène.,DNA is a complex chemical that makes up a gene.,B2,Health,3.5
3803,brun,bʁœ̃,adj.,brown / dark-haired,M. Brun est jaloux du succès de son collègue.,Mr Brown is jealous of his colleague's success.,B2,Adjectives,3.5
3804,inverser,ɛ̃vɛʁse,"v. — j'inverse, nous inversons",to reverse / to invert,Le patron a exposé les grandes lignes d'une approche en trois parties pour inverser le sort de l'entreprise.,The boss outlined a three-pronged approach to turn the fortune of the company around.,B2,Verbs,3.5
3805,réservoir,ʁezɛʁvwaʁ,n.m.,reservoir / tank,La ville est alimentée en eau par un réservoir dans les collines.,The town is supplied with water from a reservoir in the hills.,B2,General,3.5
3806,licence,lisɑ̃s,n.f.,degree / licence,J'ai obtenu ma licence cet été.,I got my license this summer.,B2,Education,3.5
3807,confronter,kɔ̃fʁɔ̃te,"v. — je confronte, nous confrontons",to confront / to compare,Un soldat doit souvent confronter le danger.,A soldier often has to confront danger.,B2,Verbs,3.5
3808,innocence,inosɑ̃s,n.f.,innocence,Tu ne dois pas profiter de son innocence.,You must not take advantage of her innocence.,B2,General,3.5
3809,débattre,debatʁ,"v. — je débats, nous débattons",to debate / to discuss,Il est imbattable lorsqu'il s'agit de débattre.,He is second to none when it comes to debating.,B2,Verbs,3.5
3810,jazz,dʒaz,n.m./f.,jazz,"À part le sport, j'aime écouter du jazz.","Apart from sports, I like listening to jazz music.",B2,Arts,3.5
3811,substance,sypstɑ̃s,n.f.,substance,Le sel est une substance utile.,Salt is a useful substance.,B2,General,3.5
3812,partant,paʁtɑ̃,adj.,present participle of partir,Mettez tout sur ma note. Je le réglerai en partant.,Put everything on my tab. I'll settle it when I check out.,B2,Adjectives,3.5
3813,désactiver,dezaktive,"v. — je désactive, nous désactivons",to disable / to deactivate,Comment puis-je désactiver mon compte sur ce site ?,How can I deactivate my account on this site?,B2,Technology,3.5
3814,char,ʃaʁ,n.m.,tank / chariot / float,"Maudit, ça me coûté deux cents piasses pour faire arranger mon char.","Darn it, it cost me two hundred bucks to get my car fixed.",B2,General,3.5
3816,relevé,ʁələve,n.m./f.,past participle of relever,Avez-vous vu le relevé de notes ?,Did you see the transcript?,B2,General,3.5
3817,décharge,deʃaʁʒ,n.m./f.,discharge,"Si tu touches à ce câble, tu vas prendre une décharge.","If you touch that wire, you will receive a shock.",B2,General,3.5
3818,projeter,pʁoʒəte,"v. — je projette, nous projetons",to project / to throw / to plan,Nous avons essayé de projeter notre analyse dans le futur.,We tried to project our analysis into the future.,B2,Verbs,3.5
3819,agneau,aɲo,n.m.,lamb,Cet enfant est doux comme un agneau aujourd'hui.,This child is as gentle as a lamb today.,B2,Food & Drink,3.5
3820,adjoint,adʒwɛ̃,n.m.,deputy / assistant,Nous nous sommes adjoint des partenaires majeurs.,We roped in some major partners.,B2,Work,3.5
3821,branler,bʁɑ̃le,"v. — je branle, branlons",to shake,Qu'est-ce que tu crois branler ?,What the fuck do you think you're doing?,B2,Verbs,3.5
3822,premièrement,pʁømjɛʁəmɑ̃,adv.,firstly,"Premièrement, je n'avais pas les moyens de le faire.","For one thing, I couldn't afford to do that.",B2,General,3.5
3823,gai,gɛ,adj.,cheerful / gay,Mon patron est très gai aujourd'hui.,My boss is very cheerful today.,B2,Emotions,3.5
3824,morale,moʁal,n.f.,morality,Il m'a fait la morale sur le fait que je boive.,He gave me a lecture on drinking.,B2,General,3.5
3825,terreur,tɛʁœʁ,n.f.,terror,Un étudiant affirme que la purge n'est pas encore terminée en Chine et que la terreur y règne.,One student says the purge is still going on in China and terror is widespread.,B2,Emotions,3.5
3826,psychologique,psikoloʒik,adj.,psychological,Les contrôleurs du trafic aérien sont soumis à une forte pression psychologique.,Air traffic controllers are under severe mental strain.,B2,Health,3.5
3827,terrifiant,tɛʁifjɑ̃,adj.,terrifying,Je n'ai jamais lu un roman aussi terrifiant que celui-ci.,Never have I read so terrifying a novel as this.,B2,Adjectives,3.5
3828,certes,sɛʁt,adv.,certainly / admittedly / granted,"Certes tu t'es trompé, mais je ne peux pas te blâmer pour cela.","On the one hand, you are wrong, but on the other hand, I can't blame you for that.",B2,General,3.5
3829,quatrième,katʁijɛm,adj.,fourth,Avril est le quatrième mois de l'année.,April is the fourth month of the year.,B2,Adjectives,3.5
3830,fraude,fʁod,n.f.,fraud,Tom fraude parfois ses clients.,Tom sometimes rips off his customers.,B2,General,3.5
3831,mépriser,mepʁize,"v. — je méprise, nous méprisons",to despise / to scorn,Tu ne devrais pas le mépriser.,You shouldn't look down on him.,B2,Verbs,3.5
3832,gravité,gʁavite,n.f.,gravity / seriousness,La gravité est la force naturelle par laquelle les objets sont attirés entre eux.,Gravity is the natural force by which objects are attracted to each other.,B2,General,3.5
3833,disperser,dispɛʁse,"v. — je disperse, nous dispersons",to scatter / to disperse,"Pour qu'une idée germe et porte ses fruits, il est nécessaire de disperser ses graines à la saison appropriée.","For an idea to germinate and to be fruitful, it is necessary to scatter its seeds in the appropriate season.",B2,Verbs,3.5
3834,loser,loze,n.m.,loser (informal),Mon petit ami n'est pas un loser.,My boyfriend is not a loser.,B2,People,3.5
3835,chantage,ʃɑ̃taʒ,n.m.,blackmail,Il exerce sur elle du chantage.,She is being blackmailed by him.,B2,General,3.5
3836,baron,baʁɔ̃,n.m.,baron,Les USA cherchent à faire extrader un baron de la drogue du Mexique.,The US is trying to extradite a drug lord from Mexico.,B2,General,3.5
3837,motiver,motive,"v. — je motive, nous motivons",to motivate,J'ai toujours du mal à me motiver le vendredi.,It's always hard for me to motivate myself on Fridays.,B2,Verbs,3.5
3838,travailleur,tʁavajœʁ,n.m.,worker / hard-working person,Ce garçon travailleur ne peut qu'avoir du succès.,That hard working boy is bound to succeed.,B2,Work,3.5
3839,automatique,otomatik,adj.,automatic,Elle a une machine à laver automatique.,She has an automatic washing machine.,B2,Adjectives,3.5
3840,col,kɔl,n.m.,collar / mountain pass / col,Il n'y a qu'un col qui franchit la montagne.,There is only one pass over the mountain.,B2,General,3.5
3841,pharmacie,faʁmasi,n.f.,pharmacy,Où se trouve la pharmacie la plus proche ?,Where's the nearest pharmacy?,B2,Body & Health,3.5
3842,jeton,ʒətɔ̃,n.m.,token / chip / counter,As-tu un jeton pour le caddie ?,Do you have a token for the shopping trolley?,B2,General,3.5
3843,attentat,atɑ̃ta,n.m.,terrorist attack / assassination attempt,Il y a eu un attentat contre le président.,There was an attempt on the president's life.,B2,General,3.5
3844,têtu,tety,adj.,stubborn / pigheaded,"Plus tu seras têtu, plus tu seras isolé.","The more stubborn you are, the more isolated you become.",B2,Adjectives,3.5
3847,énervé,enɛʁve,adj.,annoyed / irritated,J'étais énervé si bien que je ne pouvais m'endormir.,I was so excited that I could not fall asleep.,B2,Emotions,3.5
3848,réparation,ʁepaʁasjɔ̃,n.f.,repair / reparation,Ces outils ont sérieusement besoin d'une réparation.,These tools are badly in need of repair.,B2,General,3.5
3849,piqûre,pikyʁ,n.f.,sting / injection / bite,Je vous fais une piqûre analgésique.,I'll give you a painkilling injection.,B2,Health,3.5
3850,nazi,nazi,n.m./f.,Nazi,C'est quoi le pluriel de « nazi » ? « Ordures. »,"""What's the plural of Nazi?"" ""Scumbags.""",B2,General,3.5
3851,préciser,pʁesize,"v. — je précise, nous précisons",to specify / to clarify,"Au cas où ça n'est pas gratuit, veuillez me préciser combien coûtent le catalogue et le port pour le Japon.","If they are not free, please let me know how much the catalogue and the postage to Japan are.",B2,Verbs,3.5
3852,championnat,ʃɑ̃pjona,n.m.,championship,Quelle équipe a le plus de chance de gagner le championnat ?,Which team is the most likely to win the championship?,B2,Sport,3.5
3853,grippe,gʁip,n.f.,flu,John avait une mauvaise grippe la semaine dernière.,John had a bad cold last week.,B2,Body & Health,3.5
3854,barreau,baʁo,n.m.,bar (prison) / the Bar (legal),Je suis tombé du premier barreau de l'échelle.,I fell from the first rung of the ladder.,B2,General,3.5
3855,vagin,vaʒɛ̃,n.m./f.,vagina,Cela n'est pas de l'art. C'est un vagin avec des dents.,That is not art. That is a vagina with teeth.,B2,General,3.5
3856,colocataire,kolokatɛʁ,n.m./f.,flatmate / housemate,"Je suis Paul, ton colocataire.",I'm your flatmate Paul.,B2,Home,3.5
3857,académie,akademi,n.f.,academy,Il fréquenta une académie des beaux-arts afin d'étudier la peinture et la sculpture.,He went to art school to study painting and sculpture.,B2,Education,3.5
3858,ver,vɛʁ,n.m.,worm,Le ver de terre gigota lorsque je le touchai.,The earthworm wriggled when I touched it.,B2,Animals,3.5
3859,louche,luʃ,adj.,suspicious / shady / ladle,J'ai été enfermé dehors ! Il se passe vraiment quelque chose de louche.,I was locked out! There's got to be something fishy going on.,B2,Adjectives,3.5
3860,concierge,kɔ̃sjɛʁʒ,n.m./f.,concierge / caretaker,Tom est concierge dans une école.,Tom is a school janitor.,B2,Work,3.5
3861,batte,bat,n.f.,bat (baseball/cricket),"La batte de baseball a été volée hier, tout comme les balles.","The bat was stolen yesterday, along with the balls.",B2,Sport,3.5
3862,escorter,ɛskɔʁte,"v. — j'escorte, nous escortons",to escort,Les gardes du corps ont escorté le président jusqu'à sa voiture.,The bodyguards escorted the president to his car.,B2,Verbs,3.5
3863,physiquement,fizikəmɑ̃,adv.,physically,"En général, les hommes sont physiquement plus forts que les femmes.","Generally speaking, men are physically stronger than women.",B2,General,3.5
3865,sueur,sɥœʁ,n.f.,sweat / perspiration,La sueur dégouline de son visage.,Sweat is dripping from his face.,B2,Body & Health,3.5
3866,il,il,n.m./f.,he (third-person singular masculine subject pronoun for human subject),"En français, on utilise « il » pour parler d'un homme ou d'un objet masculin.","In French, ""il"" is used to refer to a man or a masculine noun.",B2,General,3.5
3867,hypothèse,ipotɛz,n.f.,hypothesis / assumption,"Sire, je n'ai pas eu besoin de cette hypothèse.","Sire, I had no need of that hypothesis.",B2,Education,3.5
3868,jean,dʒin,n.m.,jeans,Personne ne se trouvait dans la pièce à l'exception de Marie et de Jean.,There was no one in the room besides Mary and John.,B2,Shopping,3.5
3870,coco,koko,n.m.,coconut / darling (informal),"Une noix de coco, ce n'est pas une noix.",A coconut is not a nut.,B2,Food & Drink,3.5
3871,cocotte,kokɔt,n.f.,casserole dish / hen (informal),La cocotte était encore chaude.,The Dutch oven was still warm.,B2,Food & Drink,3.5
3872,rebelle,ʁəbɛl,adj.,rebellious / rebel,Les soldats ont décimé la population rebelle.,The soldiers decimated the unruly population.,B2,Adjectives,3.5
3873,âne,an,n.m.,donkey / fool,Ce n'est pas un cheval mais un âne.,"That is not a horse, but a donkey.",B2,Animals,3.5
3874,dépêche,depɛʃ,n.f.,dispatch / telegram,Ta dépêche est arrivée juste alors que j'étais sur le point de te téléphoner.,Your telegram arrived just as I was about to telephone you.,B2,General,3.5
3875,ramper,ʁɑ̃pe,"v. — je rampe, nous rampons",to crawl / to creep,Le bébé est en train de ramper.,The baby is crawling.,B2,Verbs,3.5
3876,plaquer,plake,"v. — je plaque, nous plaquons",to tackle / to dump / to plate,"À certains moments, j'ai envie de plaquer ce boulot.",At times I feel like quitting my job.,B2,Verbs,3.5
3877,équiper,ekipe,"v. — j'équipe, nous équipons",to equip / to fit out,Nous avons équipé la cuisine avec de nouveaux appareils.,We equipped the kitchen with new appliances.,B2,Verbs,3.5
3878,refroidir,ʁəfʁwadiʁ,"v. — je refroidis, nous refroidissons",to cool down / to chill,Je veux refroidir le vin un peu plus.,I want to chill the wine more.,B2,Verbs,3.5
3879,contaminer,kɔ̃tamine,"v. — je contamine, nous contaminons",to contaminate,L'eau a été contaminée par des produits chimiques.,The water was contaminated by chemicals.,B2,Health,3.5
3880,alerte,alɛʁt,n.f.,alert / warning / agile,"En cas d'urgence, alerte la police.","In case of emergency, call the police.",B2,General,3.5
3881,hockey,ɔkɛ,n.m./f.,hockey,"Parfois, les joueurs de hockey se provoquent tellement les uns les autres que des bagarres éclatent.",Sometimes hockey players get so competitive that fights break out.,B2,General,3.5
3882,enquêteur,ɑ̃kɛtœʁ,n.m.,investigator / detective,Dan était un enquêteur de la brigade scientifique.,Dan was a crime scene investigator.,B2,Work,3.5
3883,mars,maʁs,n.m.,March,Ce ne sera plus long avant de pouvoir voyager vers Mars.,It won't be long before we can travel to Mars.,A1,Time,1.0
3884,finance,finɑ̃s,n.f.,finance,"En ce qui concerne la finance, M. Jones en sait plus que quiconque dans l'entreprise.","With respect to financial matters, Mr Jones knows more than anyone else in the company.",B2,Work,3.5
3885,grenade,gʁənad,n.f.,grenade / pomegranate,"La grenade explosa avant que le terroriste ne puisse la jeter, et son bras fut déchiqueté !","The grenade blew up before the terrorist could throw it, and his arm was blown off!",B2,General,3.5
3886,emplacement,ɑ̃plasəmɑ̃,n.m.,location / site / space,Il faut déplacer le cimetière vers un nouvel emplacement au sud de la ville.,The cemetery needs to be moved to a new location south of the town.,B2,General,3.5
3887,trottoir,tʁotwaʁ,n.m.,pavement / sidewalk,J'ai glissé et suis tombé sur le trottoir verglacé.,I slipped and fell on the icy sidewalk.,B2,Geography,3.5
3888,bancaire,bɑ̃kɛʁ,adj.,banking / bank,Un scandale bancaire balaie Washington.,A banking scandal is sweeping across Capitol Hill.,B2,Work,3.5
3889,peste,pɛst,n.f.,plague / pest,Des milliers de personnes sont mortes pendant la peste.,Thousands of people died during the plague.,B2,Health,3.5
3890,vaisselle,vɛsɛl,n.f.,dishes / crockery / washing-up,Tu veux que je t'aide pour la vaisselle ?,Shall I help you with the washing-up?,B2,Home,3.5
3891,supermarché,sypɛʁmaʁʃe,n.m.,supermarket,Le nouveau supermarché a été ouvert le mois dernier.,The new supermarket was opened last month.,B2,Shopping,3.5
3892,éclair,eklɛʁ,n.m.,lightning / éclair (pastry),"""Exaucé !"" dit l'ange, et il disparut en un éclair dans un nuage de fumée.","""Done!"" says the angel, and disappears in a cloud of smoke and a bolt of lightning.",B2,Nature,3.5
3894,stand,stɑ̃d,n.m.,stand / stall / booth,"Tom va au stand, parce qu'il veut voir l'auteur.",Tom goes to the booth because he wants to see the author.,B2,General,3.5
3895,maïs,mais,n.m.,corn / maize,Le bourbon est fait à partir de maïs.,Bourbon is made from corn.,B2,Food & Drink,3.5
3896,adjoint,adʒwɛ̃,n.m./f.,"deputy, assistant",Nous nous sommes adjoint des partenaires majeurs.,We roped in some major partners.,B2,General,3.5
3897,parrain,paʁɛ̃,n.m.,godfather / sponsor,Le parrain de la maffia fut tué par une pluie de tirs d'arme automatique.,The mafia boss was killed in a hail of machine gun fire.,B2,Family,3.5
3898,détresse,detʁɛs,n.f.,distress / anguish,Le capitaine du navire ordonna à l'opérateur radio d'envoyer un signal de détresse.,The ship's captain ordered the radio operator to send a distress signal.,B2,Emotions,3.5
3899,chuter,ʃyte,"v. — je chute, nous chutons",to fall / to drop,La valeur du dollar commença à chuter.,The value of the dollar began to drop.,B2,Verbs,3.5
3900,chargé,ʃaʁʒe,adj.,loaded / busy / heavy,Tom est chargé du tournoi de tennis de cette année.,Tom is in charge of this year's tennis tournament.,B2,Adjectives,3.5
3901,similaire,similɛʁ,adj.,similar,Votre problème est similaire au mien.,Your problem is similar to mine.,B2,Adjectives,3.5
3902,stock,stɔk,n.m.,stock / supply,"Ce n'est plus en stock, mais je peux vous faire un bon.","It's out of stock, but I can give you a rain check.",B2,Work,3.5
3903,sévère,sevɛʁ,adj.,severe / strict / harsh,Son ton sévère et sa voix forte masquaient sa sensibilité intérieure et sa nature attentionnée.,His stern tone and loud voice belied his inner sensitivity and caring nature.,B2,Adjectives,3.5
3904,phénomène,fenomɛn,n.m.,phenomenon,"Le phénomène de l'intérêt est, en soi, un sujet très intéressant.","The phenomenon of interest is in itself, a most interesting subject.",B2,General,3.5
3905,évolution,evolysjɔ̃,n.f.,evolution / development,"Si je l'avais vu venir, j'aurais étouffé cette dégoûtante évolution dans l'œuf.","Had I but seen it coming, I should have nipped this revolting development in the bud.",B2,General,3.5
3906,effrayé,efʁɛje,adj.,frightened / scared,Il a été effrayé lorsque le singe lui a sauté dessus.,He was scared when the monkey jumped at him.,B2,Emotions,3.5
3907,atout,atu,n.m.,asset / trump card,C'est le moment pour toi de jouer ton atout.,The time has come for you to play your trump card.,B2,General,3.5
3908,défiler,defile,"v. — je défile, nous défilons",to parade / to scroll,Je préfère amener mes enfants voir défiler les animaux.,I prefer to bring my children to see animals parading.,B2,Verbs,3.5
3909,étiquette,etikɛt,n.f.,label / tag / etiquette,Mettez une étiquette sur tous les sacs.,Attach labels to all the bags.,B2,Shopping,3.5
3910,séquence,sekɑ̃s,n.f.,sequence,Comment puis-je extraire le son d'une séquence vidéo ?,How can I extract the audio from a video clip?,B2,General,3.5
3911,grille,gʁij,n.f.,grill / grid / gate,Attachez la grille s'il vous plait.,Fasten the gate.,B2,Home,3.5
3912,paperasse,papəʁas,n.f.,paperwork / red tape,Elle passe plus du tiers de son temps à de la paperasse.,She spends over a third of her time doing paperwork.,B2,Work,3.5
3913,ralenti,ʁalɑ̃ti,n.m.,slow motion / idle,Mes affaires tournent au ralenti en ce moment.,My business is slow right now.,B2,General,3.5
3914,satané,satane,adj.,damned / blasted (informal),Ce satané ordinateur ne fonctionne pas.,This damn computer doesn't work.,B2,Adjectives,3.5
3915,volant,volɑ̃,adj.,present participle of voler,Le personnel soignant volant peut être déployé dans tout le pays.,The mobile nursing staff can be deployed throughout the country.,B2,Adjectives,3.5
3916,parton,paʁtɔ̃,n.m.,boss (informal),C'est le parton qui décide de tout dans cette entreprise.,The boss decides everything in this company.,B2,Work,3.5
3917,passereau,pasəʁo,n.m./f.,sparrow,Un petit passereau s'est posé sur le rebord de la fenêtre.,A little sparrow landed on the window ledge.,B2,Travel,3.5
3918,revenu,ʁəvəny,n.m.,income / revenue,Je suis ravi que vous soyez revenu sain et sauf.,I am glad that you have returned safe.,B2,Work,3.5
3919,richesse,ʁiʃɛs,n.f.,wealth / richness,La santé est plus importante que la richesse.,Health is better than wealth.,B2,General,3.5
3920,insulte,ɛ̃sylt,n.f.,insult,Je ne peux pas supporter une telle insulte.,I cannot bear such an insult.,B2,General,3.5
3921,capitale,kapital,n.f.,capital city / capital letter,Kyoto était l'ancienne capitale du Japon.,Kyoto was the former capital of Japan.,B2,Geography,3.5
3922,vertu,vɛʁty,n.f.,virtue,Je lui pardonnerai en vertu de la considération que je vous porte.,I will forgive him out of consideration for you.,B2,General,3.5
3923,frein,fʁɛ̃,n.m.,brake / restraint,Appuie sur la pédale de frein pour allumer tes feux stop.,Press the brake pedal to turn on your brake lights.,B2,Travel,3.5
3924,édition,edisjɔ̃,n.f.,edition / publishing,La première édition fut publiée il y a dix ans.,The first edition was published ten years ago.,B2,Arts,3.5
3925,score,skɔʁ,n.m.,score,Quel était le score à la mi-temps ?,What was the score at halftime?,B2,Sport,3.5
3927,catholique,katolik,adj.,Catholic,Même les gens qui ne croient pas en l'église catholique vénèrent le Pape comme un leader symbolique.,Even people who don't believe in the Catholic church venerate the Pope as a symbolic leader.,B2,General,3.5
3928,décor,dekɔʁ,n.m.,decor / set / scenery,Ils admirèrent l'adorable décor.,They admired the lovely scenery.,B2,Arts,3.5
3929,maître,mɛtʁ,adj.,master,Il a réalisé son œuvre maîtresse après des années de travail.,He completed his masterpiece after years of work.,B2,Adjectives,3.5
3930,invention,ɛ̃vɑ̃sjɔ̃,n.f.,invention,Le langage tel que nous le connaissons est une invention humaine.,"Language, as we know it, is a human invention.",B2,General,3.5
3931,promouvoir,pʁomuvwaʁ,"v. — je promeus, nous promouvons",to promote,Il travailla dur à promouvoir la paix.,He worked hard to promote peace.,B2,Verbs,3.5
3932,boom,bum,n.m./f.,boom,Il a amassé une fortune en bourse lors du dernier boom financier.,He amassed a fortune in stock trading during the last boom.,B2,General,3.5
3933,mauvais,movɛ,adj.,bad / wrong / nasty,Il souhaite effacer de mauvais souvenirs.,He wishes to erase bad memories.,B2,Adjectives,3.5
3934,marchand,maʁʃɑ̃,n.m.,merchant / trader / dealer,La Royal Shakespeare Company donne une représentation du Marchand de Venise la semaine prochaine.,The Royal Shakespeare Company is presenting The Merchant of Venice next week.,B2,Shopping,3.5
3935,centime,sɑ̃tim,n.m.,centime / cent,Il m'a volé chaque centime que j'avais.,He robbed me of every cent I had.,B2,General,3.5
3936,typique,tipik,adj.,typical,"Mais c'est un pays de savane typique, et nous apprécions des températures plus fraîches.","But it's a typical savannah country, and we enjoy cooler temperatures.",B2,Adjectives,3.5
3937,attentivement,atɑ̃tivəmɑ̃,adv.,attentively / carefully,Tout le monde écoutait attentivement.,Everyone was listening very carefully.,B2,General,3.5
3938,dispositif,dispozitif,n.m.,device / mechanism / system,Nous mettrons en œuvre un dispositif de coopération Nord Sud repensé.,We will implement a reconsidered North-South cooperation mechanism.,B2,Technology,3.5
3939,dramatique,dʁamatik,adj.,dramatic,"En musique comme en rhétorique, une pause est souvent utilisée pour créer un effet dramatique.","In music or speaking, a pause is frequently used for dramatic effect.",B2,Arts,3.5
3940,came,kam,n.m./f.,cam,Tom vend de la came.,Tom sells drugs.,B2,General,3.5
3941,mairie,meʁi,n.f.,town hall / mayor's office,Combien de temps faut-il environ pour aller à pied d'ici à la mairie ?,How long does it take to walk from here to the city hall?,B2,General,3.5
3943,crochet,kʁoʃɛ,n.m.,hook / crochet,Suspends ton manteau au crochet.,Hang your coat on the hook.,B2,General,3.5
3944,temporel,tɑ̃poʁɛl,adj.,"time, temporal, time-related",Les pouvoirs temporels du roi ont diminué au fil des siècles.,The king's temporal powers diminished over the centuries.,B2,Adjectives,3.5
3945,écrit,ekʁi,n.m./f.,past participle of écrire,Il a retrouvé un vieil écrit parmi les archives de la famille.,He found an old written document among the family archives.,B2,General,3.5
3946,migraine,migʁɛn,n.f.,migraine,"Lorsque j'ai la migraine, l'aspirine ne soulage pas la douleur pour moi.","When I have migraines, aspirin doesn't alleviate the pain for me.",B2,Health,3.5
3947,soûl,su,adj.,drunk / intoxicated,Il était trop soûl pour rentrer chez lui en voiture.,He was too drunk to drive home.,B2,General,3.5
3948,désagréable,dezagʁeabl,adj.,unpleasant / disagreeable,La viande pourrie avait une odeur désagréable.,The spoiled meat had a nasty smell.,B2,Adjectives,3.5
3949,drogué,dʁoge,n.m.,drug addict,Le drogué est mort d'une surdose.,The addict died from a drug overdose.,B2,Health,3.5
3950,humide,ymid,adj.,humid / damp / wet,Il fait chaud et humide l'été.,It gets hot and humid in summer.,B2,Adjectives,3.5
3951,visiblement,vizibləmɑ̃,adv.,visibly / apparently,Il était visiblement embarrassé.,He was clearly embarrassed.,B2,General,3.5
3952,touché,tuʃe,adj.,past participle of toucher,Les vacances ont finalement touché à leur fin.,The holidays came to an end at last.,B2,Adjectives,3.5
3953,nain,nɛ̃,n.m.,dwarf,Le lancer de nain n'est pas un sport olympique.,Dwarf tossing is not an Olympic sport.,B2,People,3.5
3954,braquage,bʁakaʒ,n.m.,robbery / hold-up,Le gang a foiré le braquage et s'est fait prendre.,The gang bungled the robbery and got caught.,B2,General,3.5
3955,brosse,bʁɔs,n.f.,brush,Je brosse toujours mon manteau quand je rentre à la maison.,I always brush my coat when I come home.,B2,Home,3.5
3956,señor,seɲɔʁ,n.m.,señor / sir,"Bienvenido, señor García, nous vous attendions.","Welcome, Mr García, we were expecting you.",B2,People,3.5
3957,round,ʁund,n.m.,round (boxing/sport),Le boxeur a dominé son adversaire dès le premier round.,The boxer dominated his opponent from the first round.,B2,Sport,3.5
3958,balai,balɛ,n.m.,broom / sweep,"J'ai besoin d'un nouveau balai, celui-ci est foutu.",I need a new broom. This one's shot.,B2,Home,3.5
3959,injection,ɛ̃ʒɛksjɔ̃,n.m./f.,injection,Je tremble de peur à l'idée d'une injection.,I tremble with fear at the thought of an injection.,B2,General,3.5
3960,shopping,ʃɔpiŋ,n.m.,shopping,N'iras-tu pas faire du shopping avec moi ?,Won't you go shopping with me?,B2,Shopping,3.5
