id,fr,pron,info,en,fr_sentence,en_sentence,level,category,difficulty
2544,unir,yniʁ,"v. — j'unis, unissons","to unite, join",Nous devons nous unir pour battre l'ennemi.,We need to band together to beat the enemy.,B1,Verbs,3.0
2545,accusé,akyze,n.m./f.,accused,"À ma surprise, ce psychologue réputé a été accusé d'enlèvement.","To my surprise, the noted psychologist was accused of a kidnapping.",B1,General,3.0
2546,stratégie,stʁateʒi,n.f.,strategy,L'espoir n'est pas une stratégie.,Hope is not a strategy.,B1,General,3.0
2547,reproduire,ʁəpʁodɥiʁ,"v. — je reproduis, reproduisons",to reproduce,"La plupart des écoles ont été conçues non pas pour transformer la société, mais pour la reproduire.","Most schools were designed not to transform society, but to reproduce it.",B1,Verbs,3.0
2548,foie,fwa,n.m./f.,liver,"Un cœur, des reins et un foie surmenés sont les conséquences inévitables d'une nourriture trop abondante.","Overtaxed heart, kidneys and liver are inevitable results of too much food.",B1,Body & Health,3.0
2549,classique,klasik,adj.,classic,Betty aime la musique classique.,Betty likes classical music.,B1,Adjectives,3.0
2550,persuader,pɛʁsɥade,"v. — je persuade, persuadons",to persuade,Jimmy essaya de persuader ses parents de le laisser traverser le pays en voiture avec ses amis.,Jimmy tried to cajole his parents into letting him drive across the country with his friends.,B1,Verbs,3.0
2551,direct,diʁɛkt,n.m./f.,direct,Le match sera retransmis en direct à la télévision.,The match will be broadcast live on television.,B1,General,3.0
2552,défaut,defo,n.m.,fault / defect,Il ne lui manquait qu'un seul défaut pour être parfaite.,To be perfect she lacked just one defect.,B1,General,3.0
2553,pouls,pu,n.m./f.,pulse,Un détecteur de mensonges fonctionne en détectant les modifications du pouls et de la respiration.,A lie detector works by detecting changes in pulse and respiration.,B1,Body & Health,3.0
2554,cave,kav,n.m./f.,pitted,Nous avons passé toute cette nuit ainsi que le lendemain et la nuit suivante dans la cave.,"We spent all of that night, the next day, and the next night in the cellar.",B1,General,3.0
2555,stylo,stilo,n.m.,pen,Est-ce que vous avez un stylo ?,Have you got a pen?,B1,Education,3.0
2556,commerce,komɛʁs,n.m.,trade / commerce,Nous ne devrions pas imposer de restrictions au commerce extérieur.,We should not put restrictions on foreign trade.,B1,Shopping,3.0
2557,sourd,suʁ,adj.,deaf,Il faut de la sagesse pour comprendre la sagesse : la musique n'est rien si le public est sourd.,It requires wisdom to understand wisdom: the music is nothing if the audience is deaf.,B1,Adjectives,3.0
2558,douloureux,duluʁø,adj.,painful,Je ne peux pas tourner le cou parce que c'est très douloureux.,"I can't turn my neck, because it hurts a lot.",B1,Adjectives,3.0
2559,accueil,akœj,n.m./f.,"reception, hospitality",Puis-je commencer par remercier chacun de vous pour votre chaleureux accueil ?,May I begin by thanking every one for your warm welcome?,B1,General,3.0
2560,moderne,modɛʁn,adj.,modern,Pourquoi la technologie moderne ne s'est pas développé en Chine ?,Why didn't modern technology develop in China?,B1,Adjectives,3.0
2561,collection,kolɛksjɔ̃,n.m./f.,collection,Yoko s'intéresse à la collection de timbres.,Yoko is interested in collecting stamps.,B1,General,3.0
2563,égaler,egale,"v. — j'égale, égalons",to equal,Personne ne peut l’égaler en anglais.,No one can match him in English.,B1,Verbs,3.0
2564,répandre,ʁepɑ̃dʁ,"v. — je répands, répandons","to spill, scatter",Un petit feu de forêt peut facilement se répandre et rapidement devenir un grand incendie.,A small forest fire can easily spread and quickly become a great conflagration.,B1,Verbs,3.0
2565,formation,fɔʁmasjɔ̃,n.f.,training / education,"La formation et le mouvement des ouragans sont capricieux, même avec notre technologie contemporaine.","The formation and movement of hurricanes are capricious, even with our present-day technology.",B1,Work,3.0
2566,éternité,etɛʁnite,n.m./f.,eternity,Je ne l'ai pas vue depuis une éternité.,I haven't seen her for ages.,B1,General,3.0
2567,plainte,plɛ̃t,n.f.,complaint,Le fonctionnaire ne pouvait traiter lui-même la plainte.,The official could not deal with the complaint himself.,B1,General,3.0
2568,bol,bɔl,n.m./f.,bowl,J'en ai ras le bol d'écouter ses récriminations.,I'm sick of listening to her complaints.,B1,General,3.0
2569,harceler,aʁsəle,"v. — j'harcelle, harcelons",to hassle,Il a continué à la harceler jusqu'à ce qu'elle lui dise ce qu'il voulait savoir.,He kept badgering her until she told him what he wanted to know.,B1,Verbs,3.0
2570,griller,gʁije,"v. — je grille, grillons",to toast,Que dites-vous d'aller en griller une ?,How about a smoke?,B1,Verbs,3.0
2571,commandement,komɑ̃dəmɑ̃,n.m./f.,"command, order",Nous sommes sous son commandement.,We are under his command.,B1,General,3.0
2572,union,ynjɔ̃,n.f.,union,Le communisme est le système pratiqué en Union Soviétique.,Communism is the system practiced in the Soviet Union.,B1,General,3.0
2573,pouce,pus,n.m.,thumb,Ce gant est troué au niveau du pouce.,The glove has a hole in the thumb.,B1,Body & Health,3.0
2574,danseur,dɑ̃sœʁ,n.m./f.,ballet dancer,Chaque mouvement du danseur était parfait.,Each movement of the dancer was perfect.,B1,Arts,3.0
2575,frigo,fʁigo,n.m./f.,fridge,Il ne reste plus beaucoup de beurre dans le frigo.,There isn't much butter left in the refrigerator.,B1,Home,3.0
2576,commentaire,komɑ̃tɛʁ,n.m.,comment,Larry est monté sur ses grands chevaux en croyant que le commentaire de Fred était de mauvais goût.,"Because he thought Fred's comment was tacky, Larry got up on his high horse.",B1,General,3.0
2577,ministère,ministɛʁ,n.m./f.,ministry,Le dossier a été adressé au ministère.,The record was sent to the ministry.,B1,General,3.0
2578,tendance,tɑ̃dɑ̃s,n.m./f.,"tendency, propensity",J’ai tendance à regarder les images avant de lire le texte.,I tend to look at the pictures before reading the text.,B1,Emotions,3.0
2579,noble,nɔbl,adj.,"noble, aristocratic",Ta sœur a un air si noble qu'on dirait une princesse.,Your sister looks as noble as if she were a princess.,B1,Adjectives,3.0
2580,gentleman,dʒɛntløman,n.m./f.,"gentleman, especially an anglophone one",Ça ne peut être qu'un gentleman pour agir ainsi.,He must be a gentleman to act that way.,B1,General,3.0
2581,commandant,komɑ̃dɑ̃,adj.,commander,Le général commandant les troupes a ordonné la retraite.,The commanding general ordered the troops to retreat.,B1,Adjectives,3.0
2582,guerrier,gɛʁje,n.m./f.,warrior,Le guerrier connaît à la fois ses forces et ses faiblesses.,The warrior is conscious of both his strength and his weakness.,B1,People,3.0
2583,pénis,penis,n.m./f.,penis,Un pénis sectionné constitue une solide pièce à conviction pour un viol.,A severed penis constitutes a solid piece of evidence for rape.,B1,General,3.0
2584,espionner,ɛspjone,"v. — j'espionne, espionnons",to spy,Il est ici pour nous espionner.,He's here to spy on us.,B1,Verbs,3.0
2585,baby,bejbi,n.m./f.,"table soccer, table football",On a fait une partie de baby-foot après le déjeuner.,We played a game of table football after lunch.,B1,General,3.0
2586,accélérer,akseleʁe,"v. — j'accélère, accélérons",to accelerate,Nous devons vraiment accélérer.,We've really got to step on it.,B1,Verbs,3.0
2587,régime,ʁeʒim,n.m.,diet / regime,On va beaucoup manger ce soir alors j'espère que tu ne fais pas de régime.,We're going to eat a lot tonight so I hope you're not on a diet.,B1,Body & Health,3.0
2588,casino,kazino,n.m./f.,a casino,Il encaissa ses jetons et alla assister à un spectacle au casino d'en face.,He cashed in his chips and took in a show at the casino across the street.,B1,General,3.0
2589,exprès,ɛkspʁɛ,adj.,express,Pensez-vous qu'il a fait cette erreur exprès ?,Do you think he made that mistake on purpose?,B1,Adjectives,3.0
2590,gagnant,gaɲɑ̃,n.m./f.,"winner, victor",Quel critère avez-vous utilisé pour élire cet essai en tant que gagnant ?,What criterion did you use when you elected this essay as the winner?,B1,General,3.0
2591,bâtard,bataʁ,n.m./f.,bastard,Attends seulement que je mette la main sur ce bâtard infidèle !,Just wait till I get my hands on that two-timing bastard!,B1,People,3.0
2592,inclure,ɛ̃klyʁ,"v. — j'inclus, incluons",to include,Vous avez notre permission pour inclure notre logiciel à condition de nous fournir une copie du produit final.,You have our permission to include our software on condition that you send us a copy of the final product.,B1,Verbs,3.0
2593,tube,tyb,n.m./f.,pipe,L'essence s'échappait d'une fissure dans le tube.,Gas was escaping from a crack in the pipe.,B1,General,3.0
2594,commissariat,komisaʁja,n.m./f.,commissionership,Comment puis-je me rendre au commissariat ?,How can I get to the police station?,B1,General,3.0
2595,audition,odisjɔ̃,n.m./f.,audition,Elle souffre d'une mauvaise audition.,She is handicapped by poor hearing.,B1,Arts,3.0
2596,patrouille,patʁuj,n.m./f.,patrol,On a vu une voiture de patrouille foncer à toute vitesse.,We saw a patrol car running at full speed.,B1,General,3.0
2597,écart,ekaʁ,n.m./f.,"space, gap, interval, distance",Ce n'est probablement qu'un écart.,It's probably just a phase.,B1,General,3.0
2598,maîtresse,mɛtʁɛs,n.m./f.,mistress,C'est le moment pour vous de jouer votre carte maîtresse.,The time has come for you to play your trump card.,B1,General,3.0
2599,lent,lɑ̃,adj.,slow,Le plus lent à promettre est toujours le plus fidèle à tenir.,The slowest one to make a promise is the most faithful one in keeping it.,B1,Adjectives,3.0
2600,petit-déjeuner,pətideʒœne,n.m./f.,alternative form of petit déjeuner,Nous avons fait des crêpes pour le petit-déjeuner.,We made pancakes for breakfast.,B1,General,3.0
2601,demi-tour,dəmituʁ,n.m./f.,"U-turn, about-turn",Il est trop tard pour faire demi-tour maintenant.,It's too late to turn back now.,B1,General,3.0
2602,actuellement,aktɥɛləmɑ̃,adv.,currently,Les éléphants sont les plus gros animaux terrestres vivant actuellement.,Elephants are the largest land animals alive today.,B1,General,3.0
2603,exécution,ɛgzekysjɔ̃,n.m./f.,execution,Il est impossible de mettre ce plan à exécution.,It is impossible to put the plan into practice.,B1,General,3.0
2604,méfier,mefje,"v. — je me méfie, nous méfions","to mistrust, to be wary of, to watch out for",Il faut se méfier de l'eau qui dort.,Still waters run deep.,B1,Verbs,3.0
2605,accéder,aksede,"v. — j'accède, accédons",to reach,J'utilise souvent SSH pour accéder à mes ordinateurs à distance.,I often use SSH to access my computers remotely.,B1,Verbs,3.0
2606,comté,kɔ̃te,n.m./f.,county,Elle a rencontré un garçon à la foire du comté.,She met a boy at the county fair.,B1,Geography,3.0
2607,affirmer,afiʁme,"v. — j'affirme, affirmons","to affirm, to claim",Vous devez apprendre à vous affirmer.,You need to learn how to be assertive.,B1,Verbs,3.0
2608,chevalier,ʃəvalje,n.m./f.,knight,"Ô qu'est-ce qui peut te sauver, chevalier en armes, seul et errant hagard ?","O what can ail thee, knight-at-arms, alone and palely loitering?",B1,People,3.0
2609,tricher,tʁiʃe,"v. — je triche, trichons",to cheat,L'enseignant a surpris l'étudiant en train de tricher pendant l'examen.,The teacher caught the student cheating on the examination.,B1,Verbs,3.0
2610,influence,ɛ̃flyɑ̃s,n.f.,influence,Pensez-vous que notre climat a une influence sur notre caractère ?,Do you think our climate has an influence on our character?,B1,General,3.0
2611,panique,panik,n.f.,panic,La panique règne sur le Titanic.,Panic rules on the Titanic.,B1,Emotions,3.0
2612,visiteur,vizitœʁ,n.m./f.,visitor,Le visiteur s'assit en face de moi.,The visitor sat across from me.,B1,People,3.0
2613,stress,stʁɛs,n.m.,stress,Un poing fermé peut être une indication de stress.,A closed fist can indicate stress.,B1,Body & Health,3.0
2614,combinaison,kɔ̃binɛzɔ̃,n.m./f.,"combination, combining",Une combinaison de plusieurs erreurs conduisit à l'accident.,A combination of several mistakes led to the accident.,B1,General,3.0
2615,portrait,pɔʁtʁɛ,n.m./f.,portrait,C’est un portrait de mon défunt père.,This is a portrait of my late father.,B1,General,3.0
2616,missile,misil,n.m./f.,missile,L'attaque par missile a pris un grand nombre de vies.,The missile attack took a heavy toll of lives.,B1,General,3.0
2617,girl,gœʁl,n.m./f.,dancing girl,Anne est pom-pom girl.,Ann is a cheerleader.,B1,General,3.0
2618,tache,taʃ,n.m./f.,"blot, stain or smear",Je peux voir la plus petite tache.,I can see the tiniest spot.,B1,General,3.0
2619,voyou,vwaju,n.m./f.,"urchin, street child","Durant la fin du XXe siècle, la Yougoslavie était considérée comme un État voyou par les États-Unis.","In the late 20th century, Yugoslavia was considered a rogue state by the United States.",B1,People,3.0
2620,lion,ljɔ̃,n.m.,lion,Le lion est le roi des animaux.,The lion is the king of beasts.,B1,Animals,3.0
2621,poème,poɛm,n.m.,poem,Avez-vous déjà lu un poème chinois ?,Have you ever read any Chinese poems?,B1,Arts,3.0
2622,protocole,pʁotokɔl,n.m./f.,protocol,Je ne connaissais pas le protocole.,I didn't know the protocol.,B1,General,3.0
2623,révolution,ʁevolysjɔ̃,n.f.,revolution,"Après la Révolution, la France devint une République.","After the revolution, France became a republic.",B1,General,3.0
2624,continu,kɔ̃tiny,adj.,"continuous, uninterrupted",Le cerveau a besoin d'un afflux continu de sang.,The brain needs a continuous supply of blood.,B1,Adjectives,3.0
2625,guitare,gitaʁ,n.m./f.,guitar,"Bob ne joue pas que de la guitare, il joue aussi de la flûte.",Bob plays not only the guitar but also the flute.,B1,Arts,3.0
2626,cimetière,simətjɛʁ,n.m./f.,"cemetery, graveyard",J'ai enterré mon chien au cimetière pour animaux de compagnie.,I buried my dog at the pet cemetery.,B1,General,3.0
2627,noeud,nø,n.m./f.,nonstandard spelling of nœud,Il a fait un noeud solide avec la corde.,He tied a tight knot with the rope.,B1,General,3.0
2628,bouclier,buklije,n.m./f.,shield,Je ne dispose pas de bouclier.,I have no shield.,B1,General,3.0
2629,absurde,apsyʁd,adj.,absurd,Ta méthode d'enseigner l'anglais est absurde.,Your method of teaching English is absurd.,B1,Adjectives,3.0
2630,masse,mas,n.m./f.,"a paste, a dough",Il y a une masse de nuages noirs dans le ciel.,There is a mass of dark clouds in the sky.,B1,General,3.0
2631,conduite,kɔ̃dɥit,n.m./f.,"behavior, conduct",Tu devras répondre de ta conduite.,You'll have to answer for your behavior.,B1,General,3.0
2632,taule,tol,n.m./f.,"jail, clink",Garde la taule pendant que je suis parti.,Hold down the fort while I'm gone.,B1,General,3.0
2633,employer,ɑ̃plwaje,"v. — j'emploie, nous employons",to employ / to use,Si on veut faire du bon travail on devrait employer les outils adéquats.,"If you want to do good work, you should use the proper tools.",B1,Verbs,3.0
2634,conflit,kɔ̃fli,n.m.,conflict,Le dialogue diplomatique aida à mettre fin au conflit.,Diplomatic dialogue helped put an end to the conflict.,B1,General,3.0
2635,rage,ʁaʒ,n.f.,rage,Qui veut noyer son chien l'accuse de la rage.,Give a dog a bad name and hang him.,B1,Emotions,3.0
2636,pourri,puʁi,adj.,past participle of pourrir,"Étant donné la pluie et un hôtel pourri, nous n'avons pas vraiment goûté nos vacances.","What with the rain and a bad hotel, we didn't enjoy our holiday much.",B1,Adjectives,3.0
2637,diner,dine,n.m./f.,post-1990 spelling of dîner,Tu devrais faire des excuses à ton père pour ne pas être rentré pour l'heure du diner.,You should apologize to Dad for not coming home in time for supper.,B1,General,3.0
2638,homicide,omisid,n.m./f.,homicide,L'inculpation pour assassinat a été reclassée en homicide.,The murder charge was reduced to manslaughter.,B1,General,3.0
2639,cloche,klɔʃ,n.m./f.,bell,"Je courus à l'école, mais la cloche avait déjà retenti.","I ran to school, but the bell had already rung.",B1,General,3.0
2640,compliment,kɔ̃plimɑ̃,n.m.,compliment,Le garçon timide rougit à son compliment.,The shy boy blushed at her compliment.,B1,Emotions,3.0
2641,transfert,tʁɑ̃sfɛʁ,n.m./f.,transfer,Et ta fonction de transfert est-elle stable ?,"And your transfer function, is it stable?",B1,General,3.0
2642,belle-mère,bɛlmɛʁ,n.m./f.,mother-in-law,Je m'entends très bien avec ma belle-mère.,I'm getting along with my mother-in-law very well.,B1,Family,3.0
2643,beau-père,bopɛʁ,n.m./f.,"a father-in-law, the father of one's spouse",Le père de ma femme est mon beau-père.,My wife's father is my father-in-law.,B1,Family,3.0
2644,merveille,mɛʁvɛj,n.m./f.,wonder,Ton chapeau va à merveille avec ta robe.,Your hat matches your dress marvellously.,B1,Emotions,3.0
2645,interrogatoire,ɛ̃tɛʁogatwaʁ,n.m./f.,interrogation,Le suspect avait eu un interrogatoire sévère avant qu'il n'avoue son crime.,The suspect was given the third degree until he confessed his crime.,B1,General,3.0
2646,coopérer,koopeʁe,"v. — je coopère, coopérons",to cooperate,Les peuples d'Asie doivent coopérer.,People of Asia must work together.,B1,Verbs,3.0
2647,naturellement,natyʁɛləmɑ̃,adv.,naturally / of course,"Avec autant de personnes autour de lui, il devint naturellement un peu nerveux.",With so many people around he naturally became a bit nervous.,B1,General,3.0
2648,fidèle,fidɛl,adj.,loyal,Le plus lent à promettre est toujours le plus fidèle à tenir.,The slowest one to make a promise is the most faithful one in keeping it.,B1,Adjectives,3.0
2649,maîtriser,metʁize,"v. — je maîtrise, maîtrisons","to master, have authority over somebody","C'est assez difficile de maîtriser le français en 2, 3 ans.",It's quite difficult to master French in 2 or 3 years.,B1,Verbs,3.0
2650,oxygène,ɔksiʒɛn,n.m./f.,oxygen,On ne peut rien brûler sans oxygène.,You cannot burn anything without oxygen.,B1,General,3.0
2651,poursuite,puʁsɥit,n.m./f.,pursuit,"Après une courte poursuite, la police l'a attrapé.","After a short pursuit, the police caught him.",B1,General,3.0
2652,salopard,salopaʁ,n.m./f.,a bastard,Ce salopard m'a menti depuis le début.,This bastard has been lying to me from the start.,B1,General,3.0
2653,mouche,muʃ,n.m./f.,fly,Une mouche peut marcher sur le plafond.,A fly can walk on the ceiling.,B1,Animals,3.0
2654,allée,ale,n.m./f.,"path, lane, allée",Ça fait si longtemps depuis la dernière fois que je suis allée à Disneyland avec ma famille.,It has been so long since I last went to Disneyland with my family.,B1,Geography,3.0
2655,détenir,dɛtəniʁ,"v. — je détiens, détenons",to detain,"Quel que soit la richesse qu'il puisse détenir, il n'est jamais satisfait.","No matter how rich he may be, he is never contented.",B1,Verbs,3.0
2656,conclusion,kɔ̃klyzjɔ̃,n.f.,conclusion,La logique est une méthode systématique pour arriver à la mauvaise conclusion en toute confiance.,Logic is a systematic method of coming to the wrong conclusion with confidence.,B1,General,3.0
2657,pose,poz,n.m./f.,"installation, the act of laying, putting down",Pose ta veste sur le crochet près de la porte.,Hang your jacket on the hook by the door.,B1,General,3.0
2658,fiancer,fjɑ̃se,"v. — je fiance, fiançons",to get engaged,Je viens de me fiancer.,I just got engaged.,B1,Verbs,3.0
2659,roman,ʁomɑ̃,n.m.,novel,Avez-vous terminé de lire le roman ?,Have you finished reading the novel?,B1,Arts,3.0
2660,soupçonner,supsone,"v. — je soupçonne, soupçonnons",to suspect,Tom a commencé à soupçonner que quelque chose clochait.,Tom began to suspect something was wrong.,B1,Verbs,3.0
2661,veine,vɛn,n.m./f.,vein,Le sang s'écoulait de la veine sectionnée.,Blood poured from the cut vein.,B1,Body & Health,3.0
2662,mater,mate,"v. — je mate, matons",to checkmate,"Je suis si mauvais aux échecs qu'une fois, je me suis fait mater après seulement deux coups !","I'm so terrible at chess, I once got checkmated after only two moves!",B1,Verbs,3.0
2663,intervention,ɛ̃tɛʁvɑ̃sjɔ̃,n.m./f.,intervention,Seule une intervention chirurgicale immédiate peut sauver la vie du patient.,Only an immediate operation can save the patient's life.,B1,General,3.0
2664,ressource,ʁəsuʁs,n.f.,resource,La seule ressource plus précieuse que n'importes quelles autres était la terre.,The one resource more precious than any other was land.,B1,General,3.0
2665,féminin,feminɛ̃,adj.,feminine,Ce professeur a tendance à être partial envers les étudiantes de sexe féminin.,That teacher tends to be partial to female students.,B1,Adjectives,3.0
2666,évidence,evidɑ̃s,n.m./f.,"obviousness, clearness",La plupart des avancées scientifiques ne sont rien d'autre que la découverte d'une évidence.,Most scientific breakthroughs are nothing else than the discovery of the obvious.,B1,General,3.0
2668,pratiquement,pʁatikəmɑ̃,adv.,"in practice, for all practical purposes",Pratiquement personne ne la crut.,Almost no one believed her.,B1,General,3.0
2669,réfléchi,ʁefleʃi,adj.,past participle of réfléchir,"Tu as réfléchi sur ce problème toute la matinée. Prends une pause, va déjeuner.",You have been thinking about this problem the whole morning. Take a break; go eat lunch.,B1,Adjectives,3.0
2670,technique,tɛknik,n.f.,technique,Jetez un œil aux QFP avant d'appeler le service technique.,Take a look at the FAQ before you call tech support.,B1,General,3.0
2671,malin,malɛ̃,n.m./f.,"nocive, pernicious","Fais attention à ce malin, il va essayer de te rouler dans la farine.","Watch out for that cunning fellow, he'll try to trick you.",B1,General,3.0
2672,modifier,modifje,"v. — je modifie, nous modifions",to modify,Nous ne pouvons en aucun cas modifier l'horaire.,"At any rate, we can't change the schedule.",B1,Verbs,3.0
2673,gus,gys,n.m./f.,"bloke, guy",T'as vu ce gus qui nous regardait ?,Did you see that bloke who was watching us?,B1,People,3.0
2674,bougie,buʒi,n.m./f.,candle,La bougie a été éteinte par le vent.,The candle was blown out by the wind.,B1,Home,3.0
2675,organe,ɔʁgan,n.m./f.,organ,Le chirurgien a extrait le mauvais organe.,The surgeon removed the wrong organ.,B1,Body & Health,3.0
2676,quart,kaʁ,n.m.,quarter,J'ai passé un mauvais quart d'heure.,I had a hard time of it.,B1,Numbers,3.0
2677,aérien,aeʁjɛ̃,adj.,air,Le métier de contrôleur aérien est un métier qui procure énormément de stress.,Air traffic controller is an extremely high pressure job.,B1,Adjectives,3.0
2678,mesurer,məzyʁe,"v. — je mesure, nous mesurons",to measure,Je ne suis pas de taille à me mesurer à lui.,I am no match for him.,B1,Verbs,3.0
2679,industrie,ɛ̃dystʁi,n.f.,industry,Détroit est célèbre pour son industrie automobile.,Detroit is famous for its car industry.,B1,Work,3.0
2680,électricité,elɛktʁisite,n.m./f.,electricity,Est-ce que tu peux imaginer ce que notre vie serait sans électricité ?,Can you imagine what our lives would be like without electricity?,B1,Nature,3.0
2681,plombe,plɔ̃b,n.m./f.,full hour,On a attendu deux plombes sous la pluie.,We waited two whole hours in the rain.,B1,General,3.0
2682,plomb,plɔ̃,n.m./f.,lead,C'est aussi lourd que du plomb.,This is as heavy as lead.,B1,General,3.0
2683,amoureux,amuʁø,n.m./f.,in love,Les amoureux se promenaient main dans la main sur les Champs-Élysées.,The lovers strolled hand in hand along the Champs-Élysées.,B1,Emotions,3.0
2684,parcourir,paʁkuʁiʁ,"v. — je parcours, parcourons","to go through, to pass through",Tu ne pourras pas parcourir le livre si vite.,You will not be able to go through the book so quickly.,B1,Verbs,3.0
2685,impatient,ɛ̃pasjɑ̃,adj.,impatient,Je suis impatient de vous rencontrer.,I am looking forward to seeing you.,B1,Adjectives,3.0
2686,accent,aksɑ̃,n.m./f.,"accent, manner or tone of speech","À son accent, je peux dire qu'il est allemand.",I can tell by his accent that he is German.,B1,General,3.0
2687,louper,lupe,"v. — je loupe, loupons",to miss,Je ne veux pas louper mes examens.,I don't want to fail my exams.,B1,Verbs,3.0
2688,caution,kosjɔ̃,n.m./f.,"caution, guaranty, bail",Elle a versé une caution de 900 euros pour l'appartement.,She paid a €900 deposit for the apartment.,B1,General,3.0
2689,cookie,kuki,n.m./f.,cookie,La mère de Cookie mourut d'un cancer.,Cookie's mother died of cancer.,B1,General,3.0
2690,faiblesse,fɛblɛs,n.m./f.,weakness,John a tiré avantage de la faiblesse de Bill.,John took advantage of Bill's weakness.,B1,General,3.0
2691,impôt,ɛ̃po,n.m.,tax,Un cinquième de mon salaire part en impôt.,One-fifth of my wages go to taxes.,B1,Work,3.0
2692,culpabilité,kylpabilite,n.f.,guilt,Le verdict de culpabilité rendu par le jury a lancé un large débat.,The jury's guilty verdict gave rise to widespread debate.,B1,Emotions,3.0
2693,suspendre,syspɑ̃dʁ,"v. — je suspends, suspendons",to suspend,Où dois-je suspendre ce calendrier ?,Where shall I hang this calendar?,B1,Verbs,3.0
2694,veille,vɛj,n.m./f.,"the day before, the eve",J'imagine que j'aurai des ennuis si je ne veille pas toute la nuit pour potasser mon examen.,I suppose I'll be in trouble if I don't stay up all night to cram for the examination.,B1,Time,3.0
2695,nul,nyl,adj.,"no, none",Nul autre que toi ne peut le faire.,You're the only one who can do it.,B1,Adjectives,3.0
2696,illusion,ilyzjɔ̃,n.m./f.,illusion,"Ça semble plus long que ça, mais c'est une illusion d'optique.","This looks longer than that, but it is an optical illusion.",B1,General,3.0
2697,assiette,asjɛt,n.m./f.,"manner of being seated, situation",Plie les serviettes de table et disposes-en une à côté de chaque assiette.,Fold the napkins and put one by each plate.,B1,Food & Drink,3.0
