id,fr,pron,info,en,frSentence,enSentence,level,category,difficulty
1108,se débrouiller,sə debʀuje,v.,to manage / to get by,Il se débrouille très bien en cuisine.,He manages very well in the kitchen.,A2,Verbs,2.5
1109,se dépêcher,sə depɛʃe,v.,to hurry up,Dépêche-toi on va être en retard !,Hurry up we are going to be late!,A2,Verbs,2.5
1110,se plaindre,sə plɛ̃dʀ,"v. — je me plains, nous nous plaignons",to complain,Il se plaint toujours de tout.,He always complains about everything.,A2,Emotions,2.5
1111,se promener,sə pʀɔmne,"v. — je me promène, nous nous promenons",to go for a walk,Nous nous promenons dans le parc chaque matin.,We go for a walk in the park every morning.,A2,General,2.5
1112,se souvenir,sə suvəniʀ,"v. — je me souviens, nous nous souvenons",to remember,Je me souviens très bien de notre première rencontre.,I remember our first meeting very well.,A2,Verbs,2.5
1113,sembler,sɑ̃ble,"v. — il semble, ça semble",to seem / to appear,Il semble que le temps va changer.,It seems that the weather is going to change.,A2,Verbs,2.5
1114,sensible,sɑ̃sibl,adj.,sensitive / significant,Elle est très sensible aux critiques.,She is very sensitive to criticism.,A2,Emotions,2.5
1115,sérieux,seʀjø,adj. — sérieuse (f.),serious / reliable,C'est un employé très sérieux.,He is a very reliable employee.,A2,Adjectives,2.5
1116,service,sɛʀvis,n.m.,service / department,Le service client est ouvert de neuf à dix-huit heures.,Customer service is open from nine to six.,A2,Work,2.5
1117,signifier,siɡnifje,"v. — je signifie, nous signifions",to mean / to signify,Que signifie ce mot en français ?,What does this word mean in French?,A2,General,2.5
1118,simple,sɛ̃pl,adj.,simple / easy / plain,La solution est plus simple qu'on ne le pense.,The solution is simpler than we think.,A2,Adjectives,2.5
1119,sinon,sinɔ̃,conj.,otherwise / if not,Dépêche-toi sinon tu vas rater le bus.,Hurry up otherwise you will miss the bus.,A2,General,2.5
1120,soigner,swɑɲe,"v. — je soigne, nous soignons",to treat / to look after / to take care of,Le médecin soigne ses patients avec beaucoup d'attention.,The doctor treats his patients with great care.,A2,Body & Health,2.5
1121,solution,sɔlysjɔ̃,n.f.,solution / answer,Nous avons enfin trouvé une solution.,We have finally found a solution.,A2,General,2.5
1122,sombre,sɔ̃bʀ,adj.,dark / gloomy,La forêt est sombre et mystérieuse.,The forest is dark and mysterious.,A2,Adjectives,2.5
1123,sonner,sɔne,"v. — je sonne, nous sonnons",to ring / to sound,Le téléphone a sonné trois fois.,The phone rang three times.,A2,General,2.5
1124,souhaiter,swɛte,"v. — je souhaite, nous souhaitons",to wish / to hope,Je vous souhaite une excellente journée.,I wish you an excellent day.,A2,Greetings,2.5
1125,souple,supl,adj.,flexible / supple,Il faut être souple dans ses décisions.,We need to be flexible in our decisions.,A2,Adjectives,2.5
1126,sourire,suʀiʀ,"v./n.m. — je souris, nous sourions",to smile / smile,Elle a un sourire magnifique.,She has a magnificent smile.,A2,Emotions,2.5
1127,spécial,spesjal,adj. — spéciale (f.),special / particular,C'est un jour très spécial pour nous.,It is a very special day for us.,A2,Adjectives,2.5
1128,stresser,stʀese,"v. — je stresse, nous stressons",to stress / to be stressed,Cet examen me stresse beaucoup.,This exam stresses me a lot.,A2,Emotions,2.5
1129,stupide,stypid,adj.,stupid / foolish,Ce n'était pas une décision stupide.,It was not a stupid decision.,A2,Adjectives,2.5
1130,succès,syksɛ,n.m.,success,Son livre a eu un grand succès.,Her book was a great success.,A2,General,2.5
1131,suggérer,syɡʒeʀe,"v. — je suggère, nous suggérons",to suggest,Je suggère de prendre le train plutôt que l'avion.,I suggest taking the train rather than the plane.,A2,Verbs,2.5
1132,suivant,sɥivɑ̃,adj. — suivante (f.),following / next,La réunion aura lieu la semaine suivante.,The meeting will take place the following week.,A2,Adjectives,2.5
1133,suivre,sɥivʀ,"v. — je suis, nous suivons",to follow / to take (course),Suis les instructions à la lettre.,Follow the instructions to the letter.,A2,Verbs,2.5
1134,supérieur,sypeʀjœʀ,adj. — supérieure (f.),superior / upper / higher,Elle occupe un poste supérieur dans l'entreprise.,She holds a superior position in the company.,A2,Adjectives,2.5
1135,supporter,sypɔʀte,"v. — je supporte, nous supportons",to bear / to stand / to support,Je ne supporte pas le bruit constant.,I cannot stand the constant noise.,A2,Emotions,2.5
1136,surprendre,syʀpʀɑ̃dʀ,"v. — je surprends, nous surprenons",to surprise,Sa réaction m'a beaucoup surpris.,His reaction really surprised me.,A2,Emotions,2.5
1137,sympa,sɛ̃pa,adj.,nice / friendly (informal),Ton collègue est vraiment sympa.,Your colleague is really nice.,A2,Adjectives,2.5
1138,tableau,tablo,n.m.,painting / board / table / chart,Il y a un beau tableau au-dessus de la cheminée.,There is a beautiful painting above the fireplace.,A2,General,2.5
1139,tâche,taʃ,n.f.,task / chore / stain,J'ai beaucoup de tâches à accomplir aujourd'hui.,I have many tasks to accomplish today.,A2,Work,2.5
1140,tant,tɑ̃,adv.,so much / so many / as long as,Il y a tant de choses à découvrir ici.,There are so many things to discover here.,A2,General,2.5
1141,tarif,taʀif,n.m.,rate / price / fare,Quel est le tarif pour une chambre double ?,What is the rate for a double room?,A2,Shopping,2.5
1142,technologie,tɛknɔlɔʒi,n.f.,technology,La technologie évolue très rapidement.,Technology is evolving very rapidly.,A2,General,2.5
1143,télécharger,teleʃaʀʒe,"v. — je télécharge, nous téléchargeons",to download,J'ai téléchargé l'application sur mon téléphone.,I downloaded the app on my phone.,A2,General,2.5
1144,tellement,tɛlmɑ̃,adv.,so / so much,Il est tellement gentil avec tout le monde.,He is so kind to everyone.,A2,General,2.5
1145,tendre,tɑ̃dʀ,"adj./v. — je tends, nous tendons",tender / to hold out / to stretch,Elle a une voix douce et tendre.,She has a soft and tender voice.,A2,Adjectives,2.5
1146,terminer,tɛʀmine,"v. — je termine, nous terminons",to finish / to end,J'ai terminé mon rapport avant l'heure.,I finished my report ahead of time.,A2,Verbs,2.5
1147,timide,timid,adj.,shy / timid,Il est trop timide pour parler en public.,He is too shy to speak in public.,A2,Adjectives,2.5
1148,titre,titʀ,n.m.,title / headline,Quel est le titre de ce livre ?,What is the title of this book?,A2,General,2.5
1149,tomber amoureux,tɔ̃be amuʀø,v.,to fall in love,Il est tombé amoureux d'elle au premier regard.,He fell in love with her at first sight.,A2,Emotions,2.5
1150,total,tɔtal,adj./n.m. — totale (f.),total,Le coût total du projet s'élève à mille euros.,The total cost of the project amounts to a thousand euros.,A2,General,2.5
1151,toucher,tuʃe,"v. — je touche, nous touchons",to touch / to affect / to receive,Ne touche pas à ça c'est fragile.,Don't touch that it is fragile.,A2,Verbs,2.5
1152,toujours,tuʒuʀ,adv.,always / still / ever,Il est toujours prêt à rendre service.,He is always ready to help.,A2,General,2.5
1153,traduire,tʀadɥiʀ,"v. — je traduis, nous traduisons",to translate,Peux-tu traduire ce texte en anglais ?,Can you translate this text into English?,A2,Verbs,2.5
1154,tranquille,tʀɑ̃kil,adj.,quiet / calm / peaceful,C'est un quartier tranquille idéal pour les familles.,It is a quiet neighbourhood ideal for families.,A2,Adjectives,2.5
1155,transport,tʀɑ̃spɔʀ,n.m.,transport,Les transports en commun sont bien développés ici.,Public transport is well developed here.,A2,Travel,2.5
1156,travaux,tʀavo,n.m.pl.,works / construction / homework,Il y a des travaux sur la route nationale.,There are roadworks on the main road.,A2,General,2.5
1157,traverser,tʀavɛʀse,"v. — je traverse, nous traversons",to cross / to go through,Traversez la place et tournez à gauche.,Cross the square and turn left.,A2,Travel,2.5
1158,triste,tʀist,adj.,sad,Je suis triste de te voir partir.,I am sad to see you leave.,A2,Emotions,2.5
1159,trop,tʀo,adv.,too / too much,Il y a trop de monde dans ce restaurant.,There are too many people in this restaurant.,A2,General,2.5
1160,trouver,tʀuve,"v. — je trouve, nous trouvons",to find / to think,J'ai enfin trouvé un appartement.,I have finally found a flat.,A2,Verbs,2.5
1161,typique,tipik,adj.,typical,C'est un plat typique de la région.,It is a typical dish of the region.,A2,Adjectives,2.5
1162,unique,ynik,adj.,unique / only,C'est une occasion unique à ne pas manquer.,It is a unique opportunity not to be missed.,A2,Adjectives,2.5
1163,utile,ytil,adj.,useful,Ce dictionnaire est très utile.,This dictionary is very useful.,A2,Adjectives,2.5
1164,valable,valabl,adj.,valid / worthwhile,Ce billet est valable un mois.,This ticket is valid for one month.,A2,General,2.5
1165,vendre,vɑ̃dʀ,"v. — je vends, nous vendons",to sell,Il vend des légumes au marché.,He sells vegetables at the market.,A2,Shopping,2.5
1166,vérifier,veʀifje,"v. — je vérifie, nous vérifions",to check / to verify,Vérifie bien l'heure de ton train.,Check your train time carefully.,A2,Verbs,2.5
1167,vérité,veʀite,n.f.,truth,Il faut toujours dire la vérité.,We must always tell the truth.,A2,General,2.5
1168,vider,vide,"v. — je vide, nous vidons",to empty,Vide le lave-vaisselle s'il te plaît.,Empty the dishwasher please.,A2,Home,2.5
1169,village,vilaʒ,n.m.,village,Ce petit village est très pittoresque.,This small village is very picturesque.,A2,Travel,2.5
1170,violent,vjɔlɑ̃,adj. — violente (f.),violent,Il ne faut pas regarder des films trop violents.,We should not watch films that are too violent.,A2,Adjectives,2.5
1171,visiter,vizite,"v. — je visite, nous visitons",to visit (place),Nous avons visité le Louvre hier après-midi.,We visited the Louvre yesterday afternoon.,A2,Travel,2.5
1172,vite,vit,adv.,quickly / fast,Il conduit trop vite sur cette route.,He drives too fast on this road.,A2,General,2.5
1173,vitesse,vitɛs,n.f.,speed / gear,La vitesse maximale autorisée est de cent trente km/h.,The maximum permitted speed is one hundred and thirty km/h.,A2,Travel,2.5
1174,voici,vwasi,adv.,here is / here are,Voici les documents que vous avez demandés.,Here are the documents you requested.,A2,General,2.5
1175,voilà,vwala,adv.,there is / there you go,Voilà c'est terminé !,There you go it is finished!,A2,General,2.5
1176,voisinage,vwazinaʒ,n.m.,neighbourhood / vicinity,Il connaît tout le monde dans son voisinage.,He knows everyone in his neighbourhood.,A2,Home,2.5
1177,vol,vɔl,n.m.,flight / theft,Mon vol part à sept heures du matin.,My flight leaves at seven in the morning.,A2,Travel,2.5
1178,volontaire,vɔlɔ̃tɛʀ,adj./n.,voluntary / volunteer,Il est volontaire dans une association caritative.,He volunteers in a charitable organisation.,A2,General,2.5
1179,voyager,vwajaʒe,"v. — je voyage, nous voyageons",to travel,J'adore voyager et découvrir de nouvelles cultures.,I love travelling and discovering new cultures.,A2,Travel,2.5
1180,vrai,vʀɛ,adj. — vraie (f.),true / real / genuine,Est-ce que c'est vrai ce que tu me dis ?,Is what you are telling me true?,A2,Adjectives,2.5
1181,abandonner,abɑ̃dɔne,"v. — j'abandonne, nous abandonnons",to abandon / to give up,Il ne faut jamais abandonner ses rêves.,We must never abandon our dreams.,A2,Verbs,2.5
1182,aboutissement,abutismɑ̃,n.m.,outcome / result / culmination,C'est l'aboutissement de plusieurs années de travail.,It is the culmination of several years of work.,A2,General,2.5
1183,absence,absɑ̃s,n.f.,absence,Son absence lors de la réunion a été remarquée.,His absence during the meeting was noticed.,A2,General,2.5
1184,abstenir,apstəniʀ,"v. — je m'abstiens, nous nous abstenons",to abstain / to refrain,Il vaut mieux s'abstenir de commenter cette situation.,It is better to refrain from commenting on this situation.,A2,General,2.5
1185,accéder,aksede,"v. — j'accède, nous accédons",to access / to reach,Vous pouvez accéder au site via ce lien.,You can access the site via this link.,A2,General,2.5
1186,accroissement,akʀwasmɑ̃,n.m.,increase / growth,L'accroissement de la population pose des défis.,Population growth poses challenges.,A2,General,2.5
1187,accumulation,akymylasjɔ̃,n.f.,accumulation / build-up,L'accumulation de stress peut nuire à la santé.,The build-up of stress can harm health.,A2,Body & Health,2.5
1188,achèvement,aʃɛvmɑ̃,n.m.,completion / achievement,L'achèvement du projet est prévu pour mars.,The completion of the project is scheduled for March.,A2,Work,2.5
1189,acte,akt,n.m.,act / deed / action,Il faut passer aux actes maintenant.,We need to take action now.,A2,General,2.5
1190,acteur,aktœʀ,n.m. — actrice (f.),actor / player (key figure),Les acteurs économiques doivent s'adapter.,Economic players must adapt.,A2,General,2.5
1191,adaptation,adaptasjɔ̃,n.f.,adaptation / adjustment,L'adaptation au changement est indispensable.,Adaptation to change is indispensable.,A2,General,2.5
1192,adéquation,adekwasjɔ̃,n.f.,adequacy / match / fit,Il faut vérifier l'adéquation entre l'offre et la demande.,We need to check the match between supply and demand.,A2,Work,2.5
1193,aléatoire,aleatwaʀ,adj.,random / aleatory,La sélection des participants est aléatoire.,The selection of participants is random.,A2,General,2.5
1194,alléger,aleʒe,"v. — j'allège, nous allégeons",to lighten / to reduce / to ease,Il faut alléger la charge de travail des employés.,We need to ease the workload of employees.,A2,Work,2.5
1195,alléguer,aleɡe,"v. — j'allègue, nous alléguons",to allege / to claim,Il allègue qu'il était absent ce jour-là.,He alleges that he was absent that day.,A2,General,2.5
1196,alterner,altɛʀne,"v. — j'alterne, nous alternons",to alternate,Il faut alterner travail et repos pour être efficace.,We need to alternate work and rest to be effective.,A2,General,2.5
1197,ambiguïté,ɑ̃biɡɥite,n.f.,ambiguity,Il faut lever toute ambiguïté sur ce point.,We must remove all ambiguity on this point.,A2,General,2.5
1198,amorcer,amɔʀse,"v. — j'amorce, nous amorçons",to initiate / to start,Il faut amorcer un dialogue constructif.,We need to initiate a constructive dialogue.,A2,General,2.5
1199,ampleur,ɑ̃plœʀ,n.f.,scale / extent / scope,L'ampleur des dégâts est considérable.,The scale of the damage is considerable.,A2,General,2.5
1200,ancrer,ɑ̃kʀe,"v. — j'ancre, nous ancrons",to anchor / to embed / to root,Ces valeurs sont ancrées dans notre culture.,These values are embedded in our culture.,A2,General,2.5
1201,anticiper,ɑ̃tisipe,"v. — j'anticipe, nous anticipons",to anticipate / to foresee,Il faut anticiper les difficultés à venir.,We need to anticipate the difficulties ahead.,A2,General,2.5
1202,apaiser,apɛze,"v. — j'apaise, nous apaisons",to calm / to soothe / to ease,Il faut apaiser les tensions au sein de l'équipe.,We need to ease the tensions within the team.,A2,Emotions,2.5
1203,arbitraire,aʀbitʀɛʀ,adj.,arbitrary,Cette décision semble totalement arbitraire.,This decision seems totally arbitrary.,A2,General,2.5
1204,argumenter,aʀɡymɑ̃te,"v. — j'argumente, nous argumentons",to argue / to make a case,Il sait très bien argumenter ses positions.,He is very good at arguing his positions.,A2,General,2.5
1205,articuler,aʀtikyle,"v. — j'articule, nous articulons",to articulate / to structure,Il faut articuler clairement ses idées.,We need to articulate our ideas clearly.,A2,General,2.5
1206,assimiler,asimile,"v. — j'assimile, nous assimilons",to assimilate / to absorb,Il faut du temps pour assimiler ces nouvelles informations.,It takes time to assimilate this new information.,A2,General,2.5
1207,atout,atu,n.m.,asset / advantage / trump card,Sa maîtrise des langues est un véritable atout.,His mastery of languages is a real asset.,A2,Work,2.5
1208,attribuer,atʀibɥe,"v. — j'attribue, nous attribuons",to attribute / to assign / to award,On lui a attribué le premier prix.,He was awarded first prize.,A2,General,2.5
1209,autonomie,otɔnɔmi,n.f.,autonomy / independence,L'autonomie est une compétence clé dans ce métier.,Autonomy is a key skill in this profession.,A2,Work,2.5
1210,avérer,aveʀe,"v. — il s'avère, ils s'avèrent",to prove / to turn out,Il s'avère que la situation est plus complexe.,It turns out that the situation is more complex.,A2,General,2.5
1211,biais,bja,n.m.,bias / angle / means,Il faut éviter tout biais dans cette analyse.,We must avoid any bias in this analysis.,A2,General,2.5
1212,cadre,kadʀ,n.m.,frame / framework / manager,Dans le cadre de ce projet nous devons coopérer.,Within the framework of this project we must cooperate.,A2,Work,2.5
1213,capacité,kapasite,n.f.,capacity / ability / skill,Il a la capacité de résoudre des problèmes complexes.,He has the ability to solve complex problems.,A2,General,2.5
1214,cerner,sɛʀne,"v. — je cerne, nous cernons",to identify / to define / to pinpoint,Il faut cerner les véritables enjeux de la situation.,We need to identify the real issues of the situation.,A2,General,2.5
1215,clarifier,klaʀifje,"v. — je clarifie, nous clarifions",to clarify,Pouvez-vous clarifier votre position sur ce sujet ?,Can you clarify your position on this subject?,A2,General,2.5
1216,clé,kle,adj.,key / crucial,C'est un élément clé de notre stratégie.,It is a key element of our strategy.,A2,General,2.5
1217,cohésion,koeʒjɔ̃,n.f.,cohesion / unity,La cohésion de l'équipe est notre force principale.,Team cohesion is our main strength.,A2,Work,2.5
1218,collaboration,kɔlaboʀasjɔ̃,n.f.,collaboration,La collaboration entre les équipes est essentielle.,Collaboration between teams is essential.,A2,Work,2.5
1219,collectif,kɔlɛktif,adj./n.m. — collective (f.),collective / group,L'effort collectif a permis d'atteindre les objectifs.,The collective effort made it possible to achieve the objectives.,A2,Work,2.5
1220,complexité,kɔ̃plɛksite,n.f.,complexity,La complexité de ce problème nécessite une analyse approfondie.,The complexity of this problem requires a thorough analysis.,A2,General,2.5
1221,compromis,kɔ̃pʀɔmi,n.m.,compromise,Nous avons trouvé un compromis acceptable pour les deux parties.,We found a compromise acceptable to both parties.,A2,Work,2.5
1222,concret,kɔ̃kʀɛ,adj. — concrète (f.),concrete / tangible,Donnez-moi des exemples concrets s'il vous plaît.,Give me concrete examples please.,A2,Adjectives,2.5
1223,conditonner,kɔ̃disjɔne,"v. — je conditionne, nous conditionnons",to condition / to determine,Les résultats conditionnent les décisions futures.,The results determine future decisions.,A2,General,2.5
1224,consolider,kɔ̃sɔlide,"v. — je consolide, nous consolidons",to consolidate / to strengthen,Il faut consolider nos acquis avant d'avancer.,We need to consolidate our gains before moving forward.,A2,Work,2.5
1225,contrainte,kɔ̃tʀɛ̃t,n.f.,constraint / pressure / obligation,Les contraintes budgétaires limitent nos actions.,Budget constraints limit our actions.,A2,Work,2.5
1226,contredire,kɔ̃tʀədiʀ,"v. — je contredis, nous contredisons",to contradict,Il ne faut pas contredire le client en public.,We should not contradict the client in public.,A2,General,2.5
1227,controversé,kɔ̃tʀɔvɛʀse,adj. — controversée (f.),controversial,Cette décision est très controversée.,This decision is very controversial.,A2,Adjectives,2.5
1228,convenable,kɔ̃vnabl,adj.,suitable / appropriate / decent,Il faut adopter une tenue convenable.,We need to wear appropriate clothing.,A2,Adjectives,2.5
1229,coordonner,kɔɔʀdɔne,"v. — je coordonne, nous coordonnons",to coordinate,Il faut bien coordonner les actions de chaque équipe.,We need to coordinate the actions of each team well.,A2,Work,2.5
1230,coupable,kupabl,adj./n.,guilty / culpable,Il a été reconnu coupable de fraude fiscale.,He was found guilty of tax fraud.,A2,General,2.5
1231,courant,kuʀɑ̃,n.m.,current / trend / flow,Il faut suivre les courants d'opinion.,We must follow the currents of opinion.,A2,General,2.5
1232,critique,kʀitik,n.f./adj.,criticism / critic / critical,Elle a reçu des critiques très positives.,She received very positive reviews.,A2,General,2.5
1233,cumul,kymyl,n.m.,accumulation / combination,Le cumul des fonctions est parfois interdit.,The combination of functions is sometimes prohibited.,A2,Work,2.5
1234,décliner,dekline,"v. — je décline, nous déclinons",to decline / to turn down / to state,Il a décliné l'invitation poliment.,He declined the invitation politely.,A2,General,2.5
1235,déduire,dedɥiʀ,"v. — je déduis, nous déduisons",to deduce / to infer / to deduct,On peut déduire de ces résultats que le projet est viable.,We can deduce from these results that the project is viable.,A2,General,2.5
1236,déléguer,deleɡe,"v. — je délègue, nous déléguons",to delegate,Un bon manager sait déléguer les tâches.,A good manager knows how to delegate tasks.,A2,Work,2.5
1237,déployer,deplwaje,"v. — je déploie, nous déployons",to deploy / to unfold / to roll out,L'entreprise déploie sa nouvelle stratégie commerciale.,The company is rolling out its new commercial strategy.,A2,Work,2.5
1238,dériver,deʀive,"v. — je dérive, nous dérivons",to derive / to drift / to stem from,Ce terme dérive du latin.,This term derives from Latin.,A2,General,2.5
1239,désaccord,dezakɔʀ,n.m.,disagreement / discord,Il y a un désaccord entre les membres de l'équipe.,There is a disagreement among team members.,A2,Work,2.5
1240,désigner,deziɲe,"v. — je désigne, nous désignons",to designate / to appoint / to refer to,Il a été désigné responsable du projet.,He was designated project manager.,A2,Work,2.5
1241,déterminer,detɛʀmine,"v. — je détermine, nous déterminons",to determine / to decide,Il faut déterminer les priorités avant d'agir.,We must determine the priorities before acting.,A2,General,2.5
1242,diffuser,difyze,"v. — je diffuse, nous diffusons",to broadcast / to spread / to distribute,Le film sera diffusé ce soir à vingt heures.,The film will be broadcast tonight at eight o'clock.,A2,General,2.5
1243,dilemme,dilɛm,n.m.,dilemma,Nous sommes face à un véritable dilemme.,We are faced with a real dilemma.,A2,General,2.5
1244,diverger,divɛʀʒe,"v. — je diverge, nous divergeons",to diverge / to differ,Nos opinions divergent sur ce point précis.,Our opinions diverge on this precise point.,A2,General,2.5
1245,dominer,dɔmine,"v. — je domine, nous dominons",to dominate / to overlook / to master,Il faut dominer ses émotions dans les moments difficiles.,We must master our emotions in difficult moments.,A2,Emotions,2.5
1246,dynamique,dinamik,adj./n.f.,dynamic / dynamics,L'équipe est très dynamique et motivée.,The team is very dynamic and motivated.,A2,Adjectives,2.5
1247,écart,ekaʀ,n.m.,gap / difference / deviation,L'écart entre les salaires est trop important.,The gap between salaries is too significant.,A2,General,2.5
1248,échéance,eʃeɑ̃s,n.f.,deadline / due date / maturity,Il faut respecter les échéances du projet.,We must respect the project deadlines.,A2,Work,2.5
1249,élargir,elaʀʒiʀ,"v. — j'élargis, nous élargissons",to widen / to broaden / to expand,Il faut élargir notre champ de vision.,We need to broaden our field of vision.,A2,General,2.5
1250,élément,elemɑ̃,n.m.,element / component / factor,Chaque élément du projet est important.,Every element of the project is important.,A2,General,2.5
1251,émergent,emeʀʒɑ̃,adj. — émergente (f.),emerging,Les marchés émergents offrent de nouvelles opportunités.,Emerging markets offer new opportunities.,A2,Work,2.5
1252,enjeu,ɑ̃ʒø,n.m.,stake / issue / challenge,Les enjeux de cette décision sont considérables.,The stakes of this decision are considerable.,A2,General,2.5
1253,envisager,ɑ̃vizaʒe,"v. — j'envisage, nous envisageons",to envisage / to consider,Nous envisageons de recruter dix nouvelles personnes.,We are considering recruiting ten new people.,A2,Work,2.5
1254,épanouissement,epanwismɑ̃,n.m.,fulfilment / blossoming,L'épanouissement personnel est une priorité pour beaucoup.,Personal fulfilment is a priority for many.,A2,Emotions,2.5
1255,équitable,ekitabl,adj.,fair / equitable,Une répartition équitable des ressources est nécessaire.,A fair distribution of resources is necessary.,A2,Adjectives,2.5
1256,essor,esɔʀ,n.m.,rise / boom / development,Le secteur numérique connaît un essor remarquable.,The digital sector is experiencing remarkable growth.,A2,Work,2.5
1257,estimer,ɛstime,"v. — j'estime, nous estimons",to estimate / to consider / to value,On estime que le projet durera six mois.,It is estimated that the project will last six months.,A2,General,2.5
1258,étape,etap,n.f.,stage / step / leg,Nous en sommes à la deuxième étape du projet.,We are at the second stage of the project.,A2,Work,2.5
1259,être en mesure de,ɛtʀ ɑ̃ məzyʀ də,expr.,to be able to / to be in a position to,Nous ne sommes pas en mesure de répondre maintenant.,We are not in a position to respond now.,A2,General,2.5
1260,exclure,ɛksklɥʀ,"v. — j'exclus, nous excluons",to exclude / to rule out,On ne peut pas exclure cette hypothèse.,We cannot rule out this hypothesis.,A2,General,2.5
1261,exhaustif,ɛɡzostif,adj. — exhaustive (f.),exhaustive / comprehensive,Cette liste n'est pas exhaustive.,This list is not exhaustive.,A2,Adjectives,2.5
1262,explicite,ɛksplisit,adj.,explicit / clear,Les instructions doivent être explicites.,The instructions must be explicit.,A2,Adjectives,2.5
